url,title,price_in_rp,location,district,city,bedrooms,bathrooms,land_size_m2,building_size_m2,certificate,electricity_power,property_condition,floor_count,description
https://www.rumah123.com/properti/depok/hos11365810/#qid~5d165fc3-c246-4b4f-9ad2-ec378cfc055a,Rumah Siap Huni di Beji Depok Skandinavian Dekat 3 Akses TOL Depok,1400000000.0,"Jakarta Garden City, Jakarta Timur",Jakarta Garden City,Depok,3.0,3.0,72.0,120.0,SHM,0.0,2.0,2.0,"one gate sistem,  Kitchen set,  1 unit AC, securty 24 jam,  Carport 2 mobil"
https://www.rumah123.com/properti/depok/hos11365813/#qid~5d165fc3-c246-4b4f-9ad2-ec378cfc055a,Rumah Di Beji Depok 5 menit ke TOL Kukusan + dekat Kampus UI,1700000000.0,"Cakung, Jakarta Timur",Cakung,Depok,3.0,3.0,100.0,120.0,SHM,0.0,2.0,2.0,Full kitchen set
https://www.rumah123.com/properti/depok/hos11365824/#qid~9d33a35c-03af-4db1-8564-7eaf91b3425e,Rumah Pinggir Jalan Raden Sanim Dekat Tanah Baru & TOL Depok,1400000000.0,"Pakuwon Indah, Surabaya",Pakuwon Indah,Depok,3.0,3.0,100.0,130.0,SHM,0.0,2.0,2.0," Free Kitchen Set, Void,  Taman,  Carport 2 Mobil, Pagar"
https://www.rumah123.com/properti/depok/hos11365840/#qid~9d33a35c-03af-4db1-8564-7eaf91b3425e,Rumah Ready Stok Skandinavia Dekat Jagakarsa Jakarta Selatan Dekat Pintu Tol Kukusan Beji Depok,1700000000.0,"Kelapa Gading, Jakarta Utara",Kelapa Gading,Depok,3.0,3.0,77.0,140.0,SHM,0.0,2.0,2.0,"Carport 2 mobil, one gate system,  security 24 jam"
https://www.rumah123.com/properti/depok/hos11365839/#qid~9d33a35c-03af-4db1-8564-7eaf91b3425e,Rumah Konsep Skandinavia Indent Dekat Pintu Tol Kukusan Beji Depok,995000000.0,"Pantai Indah Kapuk, Jakarta Utara",Pantai Indah Kapuk,Depok,3.0,2.0,72.0,75.0,SHM,0.0,2.0,2.0," One gate sistem, Carport 2 mobil, smart lock door"
https://www.rumah123.com/properti/depok/hos11365834/#qid~9d33a35c-03af-4db1-8564-7eaf91b3425e,Rumah Tanah Baru Beji Depok Design Clasic Dekat Pintu Tol Kukusan,1420000000.0,"Pantai Indah Kapuk 2, Jakarta Utara",Pantai Indah Kapuk 2,Depok,3.0,3.0,86.0,110.0,SHM,0.0,2.0,2.0,"carport, torrent,  jetpump"
https://www.rumah123.com/properti/depok/hos11365826/#qid~9d33a35c-03af-4db1-8564-7eaf91b3425e,Rumah Cantik Pasti Suka Dekat Pintu Tol Kukusan Tanah Baru Beji Depok,2300000000.0,"Rungkut, Surabaya",Rungkut,Depok,4.0,3.0,127.0,170.0,SHM,0.0,2.0,2.0,"Carport 2 mobil,  service area, torrent,  jetpump"
https://www.rumah123.com/properti/depok/hos11202790/#qid~686a6a0b-4b7a-4159-89d5-18a2d956c2a1,Rumah 2 Lantai Baru Lokasi Dekat Lrt Cibubur SHM Siap Huni,1950000000.0,"Serpong, Tangerang Selatan",Serpong,Depok,3.0,3.0,125.0,136.0,SHM,2200.0,5.0,2.0," One Gate System, Keamanan 24 jam,  CCTV, Taman, Wastafel"
https://www.rumah123.com/properti/depok/hos11184239/#qid~686a6a0b-4b7a-4159-89d5-18a2d956c2a1,Rumah 1 Lantai Dekat Dengan Tol Cibubur,770000000.0,"Citraland, Surabaya",Citraland,Depok,2.0,1.0,72.0,42.0,SHM,1300.0,5.0,1.0,Keamanan 24 jam
https://www.rumah123.com/properti/depok/hos11095544/#qid~2a32200d-ed85-467d-a5ae-0ac33703137f,Dijual Rumah Luas 2 Lantai Murah Siap Huni Bonus Pohon Duren di Kavling Pertamina Cimanggis Depok,1350000000.0,"Sektor 7-Bintaro, Tangerang Selatan",Sektor 7-Bintaro,Depok,4.0,4.0,300.0,317.0,SHM,2200.0,4.0,2.0,"Tempat Jemuran, Lapangan Bola,  AC, Masjid, Akses Parkir, Kitchen Set,  Taman, Ac, Taman, Wastafel,  Masjid"
https://www.rumah123.com/properti/depok/hos10820744/#qid~b0d4bc41-db17-4512-9701-3f9f734f5040,Rumah Strategis Dekat Stasiun Depok Di Margo Residence 1 Harga All In Kpr,900000000.0,"Cipayung, Jakarta Timur",Cipayung,Depok,2.0,2.0,90.0,45.0,SHM,1300.0,4.0,1.0,"Keamanan, Taman"
https://www.rumah123.com/properti/depok/hos10681780/#qid~b0d4bc41-db17-4512-9701-3f9f734f5040,Rumah Bebas Banjir Di Cluster Acacia Dekat Margonda Harga All In Bisa Kpr,4200000000.0,"Sunter, Jakarta Utara",Sunter,Depok,3.0,4.0,194.0,120.0,SHM,2200.0,4.0,2.0,"Keamanan, Taman"
https://www.rumah123.com/properti/depok/hos10755498/#qid~8fc659a1-208c-4c24-ab80-85036a5f2453,Rumah Bebas Banjir Dekat Margonda Di Desari Residence Harga All In Kpr,1560000000.0,"Karangpilang, Surabaya",Karangpilang,Depok,3.0,2.0,72.0,90.0,SHM,2200.0,4.0,2.0,"Keamanan, Taman"
https://www.rumah123.com/properti/depok/hos10737901/#qid~8fc659a1-208c-4c24-ab80-85036a5f2453,Rumah Bebas Banjir Dekat Margonda Di Pondok Mandala Harga All In Bisa Kpr,1050000000.0,"Alam Sutera, Tangerang",Alam Sutera,Depok,5.0,2.0,83.0,154.0,SHM,2200.0,4.0,2.0,"Keamanan, Taman"
https://www.rumah123.com/properti/depok/hos10867373/#qid~bcadfd4a-091a-46d3-9d18-9dd60400cebd,Rumah Strategis Area Margonda Dekat Itc Depok Harga All In Siap Kpr,1560000000.0,"BSD, Tangerang",BSD,Depok,3.0,3.0,115.0,145.0,SHM,2200.0,4.0,2.0,"Keamanan, Taman"
https://www.rumah123.com/properti/depok/hos11359851/#qid~072f857e-71a7-4dbb-ac07-fe632e73a120,Rumah Hunian Asri di Margonda Jual Murah,4900000000.0,"Gading Serpong, Tangerang",Gading Serpong,Depok,6.0,2.0,450.0,250.0,SHM,2200.0,3.0,1.0,Tempat Jemuran
https://www.rumah123.com/properti/depok/hos11274331/#qid~e19a6201-f35d-46d3-b41d-ad1925e9277b,"Rumah strategis selangkah ke tol, margo city, ui",1730000000.0,"BSD City, Tangerang",BSD City,Depok,3.0,3.0,80.0,100.0,SHM,2200.0,5.0,2.0,"Tempat Jemuran,  Ac, Taman, Wastafel, AC, Keamanan"
https://www.rumah123.com/properti/depok/hos11263395/#qid~2a32200d-ed85-467d-a5ae-0ac33703137f,Perumahan Margonda Depok SHM Baru,1200000000.0,"BSD, Tangerang",BSD,Depok,4.0,3.0,80.0,60.0,SHM,3300.0,5.0,2.0," Jalur Telepon,  Jogging Track, Lapangan Tenis,  AC,  Lapangan Bulu Tangkis, Kulkas, Wastafel,  Pemanas Air, Jalur Telepon, Tempat Jemuran, Lapangan Bola,  Lapangan Voli,  Taman, Taman,  Tempat Gym,  Masjid,  Kolam Ikan,  Lapangan Basket,  Kitchen Set,  Ac,  Mesin Cuci,  Kolam Renang, Keamanan,  Track Lari"
https://www.rumah123.com/properti/depok/hos11276478/#qid~0c01e11f-74d7-4aa3-bf40-55c33763b2f4,Rumah Luas Dekat Margonda Raya,4900000000.0,"Gading Serpong, Tangerang",Gading Serpong,Depok,6.0,2.0,400.0,250.0,SHM,2200.0,3.0,2.0,"Tempat Jemuran, Jalur Telepon,  Taman"
https://www.rumah123.com/properti/depok/hos11367923/#qid~9777f3ac-a22b-4abe-b087-b1ff4ff01901,Dijual Hunian mewah premium 2 Lantai di pusat kota Depok Jawa barat,1000000000.0,"Alam Sutera, Tangerang",Alam Sutera,Depok,4.0,4.0,100.0,66.0,SHM,2200.0,5.0,2.0," Jogging Track, Track Lari, Kolam Renang, Taman,  Masjid,  Keamanan"
https://www.rumah123.com/properti/depok/hos10741434/#qid~072f857e-71a7-4dbb-ac07-fe632e73a120,"Cluster termurah Strategis minimalis dekat GDC, cash SHM",350000000.0,"BSD City, Tangerang",BSD City,Depok,2.0,1.0,50.0,36.0,SHM,1300.0,5.0,1.0,"Keamanan 24 jam, Masjid, Keamanan,  Taman"
https://www.rumah123.com/properti/depok/hos11213036/#qid~29e57da4-9ae0-4422-8132-8c84af792680,Rumah  Depok Gdc Akses Stasiun 1 Lt Siap Huni Bisa Kpr Dekat Alun Alun,660000000.0,"BSD, Tangerang",BSD,Depok,2.0,1.0,72.0,72.0,HGB,1300.0,4.0,1.0,Keamanan 24 jam
https://www.rumah123.com/properti/depok/hos11161484/#qid~072f857e-71a7-4dbb-ac07-fe632e73a120,Rumah Nyaman Dalam Komplek Dekat Pintu Tol di Pancoran Mas,870000000.0,"Alam Sutera, Tangerang",Alam Sutera,Depok,3.0,3.0,60.0,85.0,SHM,2200.0,5.0,2.0," Jalur Telepon,  Ac, Tempat Jemuran, AC,  Track Lari, Masjid,  Taman,  CCTV, Wastafel, Lapangan Voli, Jogging Track, Jalur Telepon,  Keamanan, Lapangan Basket"
https://www.rumah123.com/properti/depok/hos11219942/#qid~072f857e-71a7-4dbb-ac07-fe632e73a120,Rumah Mewah Nyaman 900 Meter Ke Pintu Tol,890000000.0,"BSD City, Tangerang",BSD City,Depok,3.0,3.0,68.0,90.0,SHM,2200.0,5.0,2.0," Jalur Telepon,  AC, Masjid,  CCTV, Kulkas, Wastafel,  Pemanas Air, CCTV, Jalur Telepon, Tempat Jemuran,  Akses Parkir,  One Gate System, Keamanan 24 jam,  Taman,  Tempat Laundry, Ac,  Playground,  Masjid,  Keamanan,  Mesin Cuci"
https://www.rumah123.com/properti/depok/hos11281187/#qid~76ce0e84-4396-4d75-b2fc-42ebc8ebf9b5,"Rumah Termurah 2 Lantai di Krukut, Depok",800000000.0,"BSD City, Tangerang",BSD City,Depok,3.0,2.0,80.0,70.0,SHM,1300.0,5.0,2.0," Ac,  Jogging Track, Track Lari,  Taman, Taman, AC,  Masjid, CCTV, Jalur Telepon,  Keamanan"
https://www.rumah123.com/properti/depok/hos11367287/#qid~36cdc29f-018e-4cf0-8880-2e259e050681,Rumah Mewah 2 Lantai Model Scandinavian Modern Cinere Krukut. Lokasi 50 Meter Dari Jalan Raya Krukut,1170000000.0,"Buah Batu, Bandung",Buah Batu,Depok,3.0,2.0,93.0,88.0,SHM,2200.0,5.0,2.0,"Tempat Jemuran,  One Gate System, Masjid, Keamanan 24 jam,  Taman,  CCTV, Taman, CCTV"
https://www.rumah123.com/properti/depok/hos10479580/#qid~072f857e-71a7-4dbb-ac07-fe632e73a120,Rumah Siap Huni Carport 2 Mobil Dekat Tol Kukusan Beji Depok,1250000000.0,"Grand Wisata, Bekasi",Grand Wisata,Depok,3.0,3.0,72.0,110.0,SHM,2200.0,5.0,2.0," Jalur Telepon,  Ac,  Jogging Track, Track Lari, Taman, AC,  Masjid, CCTV, Jalur Telepon,  Keamanan"
https://www.rumah123.com/properti/depok/hos11335427/#qid~9ce4817e-4140-4eb8-a138-c33b7ee58a54,Rumah Baru Modern 2 Lantai di Tanah Baru Depok,1100000000.0,"Setiabudi, Bandung",Setiabudi,Depok,3.0,2.0,92.0,100.0,SHM,2200.0,5.0,2.0,"Tempat Jemuran, Keamanan, Wastafel, Taman"
https://www.rumah123.com/properti/depok/hos8175668/#qid~e19a6201-f35d-46d3-b41d-ad1925e9277b,Rumah Siap Huni Akses 2 Mobil 5 Menit Ke Tol Kukusan Beji Depok,1450000000.0,"Pancoran Mas, Depok",Pancoran Mas,Depok,3.0,3.0,98.0,130.0,SHM,2200.0,5.0,2.0," Jalur Telepon,  Jogging Track,  AC, Masjid, Kitchen Set,  CCTV, Wastafel, Jalur Telepon, Tempat Jemuran,  Akses Parkir,  One Gate System, Keamanan 24 jam,  Taman,  Tempat Laundry, Ac, Taman,  Masjid,  Keamanan, Track Lari"
https://www.rumah123.com/properti/depok/hos11198041/#qid~e19a6201-f35d-46d3-b41d-ad1925e9277b,Rumah Mewah Strategis Selangkah Ke Tol Kukusan Beji Depok,900000000.0,"Sentul City, Bogor",Sentul City,Depok,3.0,2.0,60.0,75.0,SHM,2200.0,5.0,1.0,"Tempat Jemuran,  Ac,  Akses Parkir,  One Gate System, Masjid, Keamanan 24 jam,  Taman,  Tempat Laundry,  CCTV,  Playground, Wastafel, AC,  Masjid, CCTV, Jalur Telepon,  Keamanan"
https://www.rumah123.com/properti/depok/hos8449170/#qid~cb65ff42-c6d2-4129-910a-ea72db550fe8,Rumah Murah  Di Tanah Baru-Beji-Depok siap huni,1300000000.0,"Jati Asih, Bekasi",Jati Asih,Depok,3.0,3.0,98.0,130.0,SHM,2200.0,5.0,2.0,"Ac, Taman"
https://www.rumah123.com/properti/depok/hos10755124/#qid~cb65ff42-c6d2-4129-910a-ea72db550fe8,Rumah Mewah Selangkah Ke Jakarta Selatan,2310000000.0,"Sentul City, Bogor",Sentul City,Depok,5.0,5.0,127.0,180.0,SHM,2200.0,5.0,2.0," Ac,  Taman,  CCTV, Taman, AC, CCTV, Jalur Telepon, Keamanan"
https://www.rumah123.com/properti/depok/hos11095366/#qid~e2fd375c-9055-42a6-a2aa-920eb4f1b090,di JUAL Rumah MURAH full FURNISHED dekat Tol ANDARA-KUKUSAN,1430000000.0,"Grand Wisata, Bekasi",Grand Wisata,Depok,4.0,2.0,100.0,90.0,SHM,2200.0,5.0,2.0,"CCTV, Ac,  Taman"
https://www.rumah123.com/properti/depok/hos10710219/#qid~e19a6201-f35d-46d3-b41d-ad1925e9277b,Murah Rumah Cluster di Kukusan Beji Depok,575000000.0,"Kota Wisata, Bogor",Kota Wisata,Depok,2.0,1.0,46.0,36.0,SHM,1300.0,5.0,1.0,Taman
https://www.rumah123.com/properti/depok/hos11008495/#qid~fafcda64-9515-4f34-9a72-7e4ac7b4b122,Rumah Tinggal 2 Lantai Belakang Kampus Ui Dekat Pintu Tol Kukusan,3200000000.0,"Citra Garden, Jakarta Barat",Citra Garden,Depok,4.0,3.0,268.0,140.0,SHM,2200.0,4.0,2.0,"Taman, AC"
https://www.rumah123.com/properti/depok/hos5031868/#qid~29e57da4-9ae0-4422-8132-8c84af792680,Rumah Cluster elit harga irit di Depok aksea 2 pintu Tol,485000000.0,"Summarecon Bekasi, Bekasi",Summarecon Bekasi,Depok,2.0,1.0,72.0,50.0,SHM,1300.0,3.0,1.0," Jalur Telepon, Tempat Jemuran, Lapangan Bola, Lapangan Tenis,  Kolam Renang, Kitchen Set,  Lapangan Voli,  Lapangan Bulu Tangkis,  Taman, Wastafel,  Pemanas Air, Jogging Track,  Masjid, Jalur Telepon, Keamanan,  Track Lari"
https://www.rumah123.com/properti/depok/hos10605625/#qid~fafcda64-9515-4f34-9a72-7e4ac7b4b122,Rumah 2 Lntai depok lokasi dekat Tol cijago.,506000000.0,"Grand Wisata, Bekasi",Grand Wisata,Depok,2.0,2.0,40.0,46.0,SHM,2200.0,5.0,2.0," Ac, CCTV, Keamanan"
https://www.rumah123.com/properti/depok/hos11368613/#qid~fafcda64-9515-4f34-9a72-7e4ac7b4b122,Rumah Lux 2 Lantai Brand New Dekat ke Stasiun Depok Lama,980000000.0,"Beji, Depok",Beji,Depok,3.0,2.0,80.0,70.0,SHM,2200.0,5.0,2.0,"Tempat Jemuran,  One Gate System, Keamanan 24 jam, Taman, Wastafel, CCTV, Keamanan"
https://www.rumah123.com/properti/depok/hos11368613/#qid~38acb536-ac61-45c8-bd66-8e64ee36e937,Rumah Lux 2 Lantai Brand New Dekat ke Stasiun Depok Lama,980000000.0,"Summarecon Bandung, Bandung",Summarecon Bandung,Depok,3.0,2.0,80.0,70.0,SHM,2200.0,5.0,2.0,"Tempat Jemuran,  One Gate System, Keamanan 24 jam, Taman, Wastafel, CCTV, Keamanan"
https://www.rumah123.com/properti/depok/hos11368613/#qid~301ea5dd-df49-4a64-88fd-05d552c9592d,Rumah Lux 2 Lantai Brand New Dekat ke Stasiun Depok Lama,980000000.0,"Cengkareng, Jakarta Barat",Cengkareng,Depok,3.0,2.0,80.0,70.0,SHM,2200.0,5.0,2.0,"Tempat Jemuran,  One Gate System, Keamanan 24 jam, Taman, Wastafel, CCTV, Keamanan"
https://www.rumah123.com/properti/depok/hos11368402/#qid~d0b711ad-e7c0-4366-841c-d589ce2c1a61,Rumah Baru Modern 2 Lantai All In Dekat Stasiun Depok Lama,846000000.0,"Tanah Sareal, Bogor",Tanah Sareal,Depok,3.0,2.0,63.0,70.0,SHM,2200.0,5.0,2.0,"Tempat Jemuran, Taman, Wastafel"
https://www.rumah123.com/properti/depok/hos11367082/#qid~36cdc29f-018e-4cf0-8880-2e259e050681,Rumah Mewah 2 Lantai Model Scandinavian Modern Cinere Krukut. Lokasi 50 Meter Dari Jalan Raya Krukut,1170000000.0,"Cimanggis, Depok",Cimanggis,Depok,2.0,1.0,93.0,88.0,SHM,1300.0,5.0,1.0,"Tempat Jemuran,  One Gate System, Masjid, Keamanan 24 jam,  Taman,  CCTV, CCTV, Jalur Telepon"
https://www.rumah123.com/properti/depok/hos11367082/#qid~52898363-0dd2-435a-b943-62409e1e0a50,Rumah Mewah 2 Lantai Model Scandinavian Modern Cinere Krukut. Lokasi 50 Meter Dari Jalan Raya Krukut,1170000000.0,"Bekasi Timur, Bekasi",Bekasi Timur,Depok,2.0,1.0,93.0,88.0,SHM,1300.0,5.0,1.0,"Tempat Jemuran,  One Gate System, Masjid, Keamanan 24 jam,  Taman,  CCTV, CCTV, Jalur Telepon"
https://www.rumah123.com/properti/jakarta-barat/hos11351756/#qid~347266bb-2823-45c0-9172-42c380446204,Chandra Rumah 2 Lantai Uk 12.5x20.5m Lokasi Bagus Komplek Kavling Polri,6800000000.0,"Lebak Bulus, Jakarta Selatan",Lebak Bulus,Jakarta Barat,4.0,3.0,260.0,387.0,SHM,5500.0,4.0,2.0,Jalur Telepon
https://www.rumah123.com/properti/jakarta-barat/hos11351705/#qid~347266bb-2823-45c0-9172-42c380446204,Chandra Rumah Baru 3.5 Lantai Uk 4x15m Hadap Timur di Jelambar,1650000000.0,"Pondok Indah, Jakarta Selatan",Pondok Indah,Jakarta Barat,3.0,3.0,60.0,132.0,SHM,2200.0,4.0,3.0,Jalur Telepon
https://www.rumah123.com/properti/jakarta-barat/hos11279684/#qid~7a8ea572-c6d8-4a20-9030-cfd60d8b46b9,Chandra Rumah Uk 5x18m Lokasi Bagus di Jelambar,2400000000.0,"Duren Sawit, Jakarta Timur",Duren Sawit,Jakarta Barat,5.0,4.0,89.0,227.0,SHM,0.0,4.0,3.0,Tempat Jemuran
https://www.rumah123.com/properti/jakarta-barat/hos11279697/#qid~7a8ea572-c6d8-4a20-9030-cfd60d8b46b9,Dhyana Rumah 2lt Uk 7x16m di Komplek Kavling Polri,3550000000.0,"Kemandoran, Jakarta Selatan",Kemandoran,Jakarta Barat,4.0,2.0,112.0,160.0,SHM,0.0,4.0,2.0,Tempat Jemuran
https://www.rumah123.com/properti/jakarta-barat/hos11279752/#qid~7a8ea572-c6d8-4a20-9030-cfd60d8b46b9,"Dhyana Rumah Uk 6x14m di Komplek Dutasquare, Dutamas",2400000000.0,"Cipayung, Jakarta Timur",Cipayung,Jakarta Barat,5.0,2.0,84.0,144.0,SHM,0.0,4.0,3.0,Tempat Jemuran
https://www.rumah123.com/properti/jakarta-barat/hos11275630/#qid~6ae299a9-a659-44a9-b6d8-e8a4a618330a,Dhyana Rumah 2 Lantai Uk 6x20m di Komplek Kavling Polri,3550000000.0,"Pondok Indah, Jakarta Selatan",Pondok Indah,Jakarta Barat,3.0,2.0,120.0,200.0,SHM,3500.0,4.0,2.0,Jalur Telepon
https://www.rumah123.com/properti/jakarta-barat/hos11139786/#qid~1f9919b6-2578-4678-aa91-e24953424d5d,Dhyana Rumah Uk 5x15m Lokasi Bagus di Komplek Kavling Polri,2600000000.0,"Cipinang, Jakarta Timur",Cipinang,Jakarta Barat,4.0,3.0,75.0,150.0,SHM,0.0,4.0,1.0,Tempat Jemuran
https://www.rumah123.com/properti/jakarta-barat/hos11139870/#qid~1f9919b6-2578-4678-aa91-e24953424d5d,Dhyana Rumah Uk 7x15m Bangunan Bagus di Komplek Kavling Polri,3700000000.0,"Cipete, Jakarta Selatan",Cipete,Jakarta Barat,4.0,4.0,105.0,196.0,SHM,0.0,4.0,3.0,Tempat Jemuran
https://www.rumah123.com/properti/jakarta-barat/hos11139899/#qid~1f9919b6-2578-4678-aa91-e24953424d5d,Dhyana Rumah Fullfurnish Uk 4x16m di Jelambar,2200000000.0,"Cibubur, Jakarta Timur",Cibubur,Jakarta Barat,4.0,3.0,64.0,168.0,SHM,0.0,4.0,3.0,Tempat Jemuran
https://www.rumah123.com/properti/jakarta-barat/hos11139844/#qid~1f9919b6-2578-4678-aa91-e24953424d5d,Dhyana Rumah 3.5lt Hadap Selatan di Komplek Kavling Polri,2100000000.0,"Cilandak, Jakarta Selatan",Cilandak,Jakarta Barat,3.0,3.0,50.0,128.0,SHM,0.0,5.0,3.0,Tempat Jemuran
https://www.rumah123.com/properti/jakarta-barat/hos11131470/#qid~fbf64b4a-4bb4-495c-8a32-3cd48b03d20b,Andre Tjhia Jelambar Rumah Lebar Jalan 3 Mobil Bangunan 4 Lantai Bagus,1800000000.0,"Serpong, Tangerang Selatan",Serpong,Jakarta Barat,3.0,3.0,61.0,144.0,SHM,2200.0,4.0,4.0,"Keamanan 24 jam, Keamanan"
https://www.rumah123.com/properti/jakarta-barat/hos10992365/#qid~99812524-8f47-4db6-bf39-5ce0a95d8b67,Dhyana Rumah Luas 225m2 di Komplek Kavling Polri,4700000000.0,"Rungkut, Surabaya",Rungkut,Jakarta Barat,1.0,1.0,225.0,255.0,HGB,0.0,4.0,1.0,Jalur Telepon
https://www.rumah123.com/properti/jakarta-barat/hos11075691/#qid~99812524-8f47-4db6-bf39-5ce0a95d8b67,Chandra Rumah Lt 135m2 Bangunan Bagus di Jelambar,3000000000.0,"Pantai Indah Kapuk 2, Jakarta Utara",Pantai Indah Kapuk 2,Jakarta Barat,3.0,3.0,135.0,250.0,SHM,4400.0,4.0,3.0,Jalur Telepon
https://www.rumah123.com/properti/jakarta-barat/hos11075385/#qid~99812524-8f47-4db6-bf39-5ce0a95d8b67,Chandra Rumah Kos Baru Uk 8x17m Lokasi Bagus di Jelambar,5500000000.0,"Rungkut, Surabaya",Rungkut,Jakarta Barat,10.0,11.0,136.0,336.0,SHM,0.0,5.0,4.0,Jalur Telepon
https://www.rumah123.com/properti/jakarta-barat/hos11244648/#qid~686f55dc-4221-49cb-9398-499b8aff3b6f,Rumah di Jalan pakuwon 3 Lantai Bagus SHM Barat,4000000000.0,"Gading Serpong, Tangerang",Gading Serpong,Jakarta Barat,6.0,2.0,198.0,500.0,SHM,7700.0,4.0,3.0,"Jalur Telepon, Ac, AC, Wastafel,  Keamanan, Tempat Jemuran"
https://www.rumah123.com/properti/jakarta-barat/hos11198674/#qid~7eb3b02b-be4c-4c03-b916-364c80f7a648,Dhyana Rumah Uk 15x16m Bangunan Bagus di Komplek Kavling Polri,6300000000.0,"Citraland, Surabaya",Citraland,Jakarta Barat,5.0,6.0,233.0,315.0,SHM,0.0,4.0,2.0,"Tempat Jemuran, Jalur Telepon"
https://www.rumah123.com/properti/jakarta-barat/hos11198693/#qid~7eb3b02b-be4c-4c03-b916-364c80f7a648,Dhyana Rumah Uk 7x20m di Komplek Dutamas,3000000000.0,"Kelapa Gading, Jakarta Utara",Kelapa Gading,Jakarta Barat,3.0,3.0,140.0,140.0,SHM,0.0,4.0,1.0,Tempat Jemuran
https://www.rumah123.com/properti/jakarta-barat/hos11174140/#qid~7eb3b02b-be4c-4c03-b916-364c80f7a648,Chandra Rumah Fullfurnish Uk 4x16m di Jelambar,2200000000.0,"Pantai Indah Kapuk, Jakarta Utara",Pantai Indah Kapuk,Jakarta Barat,4.0,3.0,64.0,168.0,SHM,3500.0,4.0,3.0,Tempat Jemuran
https://www.rumah123.com/properti/jakarta-barat/hos11192751/#qid~7eb3b02b-be4c-4c03-b916-364c80f7a648,"Dhyana Rumah Uk 5,5x16m Lokasi Bagus di Jelambar",2700000000.0,"Citraland, Surabaya",Citraland,Jakarta Barat,6.0,4.0,88.0,200.0,SHM,6600.0,4.0,4.0,Jalur Telepon
https://www.rumah123.com/properti/jakarta-barat/hos11192791/#qid~7eb3b02b-be4c-4c03-b916-364c80f7a648,Dhyana Rumah Hoek Luas 377m2 Lokasi Sangat Bagus di Komplek Kavling Polri,8490000000.0,"Kelapa Gading, Jakarta Utara",Kelapa Gading,Jakarta Barat,4.0,4.0,377.0,712.0,SHM,5500.0,4.0,3.0,Jalur Telepon
https://www.rumah123.com/properti/jakarta-barat/hos11168388/#qid~7eb3b02b-be4c-4c03-b916-364c80f7a648,Chandra Rumah Uk 5x15m Lokasi Bagus di Komplek Kavling Polri,2600000000.0,"Bintaro, Tangerang Selatan",Bintaro,Jakarta Barat,3.0,3.0,75.0,150.0,SHM,2200.0,4.0,3.0,Jalur Telepon
https://www.rumah123.com/properti/jakarta-barat/hos10992365/#qid~d170ce10-a300-4504-babc-a13c26075f72,Dhyana Rumah Luas 225m2 di Komplek Kavling Polri,4700000000.0,"Lippo Karawaci, Tangerang",Lippo Karawaci,Jakarta Barat,1.0,1.0,225.0,255.0,HGB,0.0,4.0,1.0,Jalur Telepon
https://www.rumah123.com/properti/jakarta-barat/hos10875790/#qid~5eb8788e-8cee-4939-a752-2f362be89329,Chandra rumah Gandeng 3.5 Lantai Uk 9.4x15m Plong di Jelambar,3950000000.0,"Alam Sutera, Tangerang",Alam Sutera,Jakarta Barat,1.0,1.0,141.0,282.0,SHM,0.0,4.0,3.0,Jalur Telepon
https://www.rumah123.com/properti/jakarta-barat/hos11257701/#qid~6d549e56-37b4-4dcb-b253-375543902dd7,Chandra Rumah Hoek Lt 282m2 Shm Murni di Komplek Dutamas,5500000000.0,"Tangerang, Tangerang",Tangerang,Jakarta Barat,3.0,3.0,282.0,300.0,SHM,2200.0,4.0,2.0,Jalur Telepon
https://www.rumah123.com/properti/jakarta-barat/hos11259513/#qid~6d549e56-37b4-4dcb-b253-375543902dd7,Chandra Rumah Uk 11x14m Lokasi Strategis di Jelambar,3000000000.0,"Pakujaya, Tangerang",Pakujaya,Jakarta Barat,3.0,2.0,156.0,123.0,SHM,0.0,4.0,1.0,Jalur Telepon
https://www.rumah123.com/properti/jakarta-barat/hos11108407/#qid~012bf8e4-f1ec-45c3-a438-76571f775f3b,Chandra Rumah Lama Lt 192m2 Lokasi Bagus di Komplek Kavling Polri,3350000000.0,"Cipondoh, Tangerang",Cipondoh,Jakarta Barat,1.0,1.0,192.0,192.0,SHM,0.0,4.0,1.0,Jalur Telepon
https://www.rumah123.com/properti/jakarta-barat/hos11317251/#qid~e6a9f1bd-cb61-4026-af5a-80557b460232,"Dhyana Rumah Uk 11.5x22.5m Lokasi Bagus Komplek Thi, Jelambar",6500000000.0,"BSD, Tangerang",BSD,Jakarta Barat,6.0,5.0,258.0,400.0,SHM,0.0,4.0,2.0,Tempat Jemuran
https://www.rumah123.com/properti/jakarta-barat/hos11317213/#qid~e6a9f1bd-cb61-4026-af5a-80557b460232,Chandra Rumah Uk 4.5x19m Harga Murah di Jelambar,1850000000.0,"Bandung Timur, Bandung",Bandung Timur,Jakarta Barat,3.0,3.0,84.0,189.0,HGB,0.0,4.0,3.0,Tempat Jemuran
https://www.rumah123.com/properti/jakarta-barat/hos11318051/#qid~e6a9f1bd-cb61-4026-af5a-80557b460232,Chandra Rumah Baru Uk 3.75x14.5m di Komplek Kavling Polri,2300000000.0,"Bekasi Utara, Bekasi",Bekasi Utara,Jakarta Barat,4.0,3.0,55.0,131.0,SHM,0.0,5.0,3.0,Tempat Jemuran
https://www.rumah123.com/properti/jakarta-barat/hos11307960/#qid~4b22cd4b-f458-4cb0-aea2-1cc22e3def3f,"Rumah Dutamas 378m, Kondisi Bagus Rapi Siap Huni, Semi Furnish",12000000000.0,"Cileungsi, Bogor",Cileungsi,Jakarta Barat,5.0,4.0,378.0,1000.0,SHM,6600.0,4.0,3.0,Tempat Jemuran
https://www.rumah123.com/properti/jakarta-barat/hos11236710/#qid~db2fa181-5285-44dd-8818-8e5cff587799,Chandra Rumah Uk 3x12m Jalan 2 Mobil di Jelambar,1350000000.0,"Galaxy, Bekasi",Galaxy,Jakarta Barat,3.0,3.0,36.0,73.0,SHM,3500.0,4.0,4.0,Jalur Telepon
https://www.rumah123.com/properti/jakarta-barat/hos11236394/#qid~db2fa181-5285-44dd-8818-8e5cff587799,"Chandra Rumah Uk 7,8x15m Bebas Banjir di Jelambar",2500000000.0,"Sentul, Bogor",Sentul,Jakarta Barat,3.0,2.0,117.0,150.0,SHM,0.0,4.0,2.0,Jalur Telepon
https://www.rumah123.com/properti/jakarta-barat/hos11195347/#qid~db2fa181-5285-44dd-8818-8e5cff587799,Chandra Rumah Hoek 2.5 Lantai Luas 377m2 Lokasi Bagus Komplek Kavling Porli,8500000000.0,"Jati Asih, Bekasi",Jati Asih,Jakarta Barat,4.0,4.0,377.0,570.0,SHM,5500.0,4.0,2.0,Jalur Telepon
https://www.rumah123.com/properti/jakarta-barat/hos11100980/#qid~edb6f11f-458c-42fb-99e8-d33808edc921,Ip2515 Rumah Furnished 4x20 Kavling Polri Jelambar,2700000000.0,"Bogor Utara, Bogor",Bogor Utara,Jakarta Barat,3.0,3.0,80.0,170.0,SHM,2200.0,4.0,3.0,"Keamanan 24 jam, Taman, Kitchen Set,  AC, Wastafel, Tempat Jemuran"
https://www.rumah123.com/properti/jakarta-barat/hos11099987/#qid~edb6f11f-458c-42fb-99e8-d33808edc921,Ip2514 Rumah Furnished 5x15 Kavling Polri Jelambar,2600000000.0,"Cikarang, Bekasi",Cikarang,Jakarta Barat,3.0,3.0,75.0,150.0,SHM,5500.0,4.0,3.0,"Keamanan 24 jam, Taman, Lapangan Voli, Kitchen Set,  AC, Wastafel, Track Lari, Tempat Jemuran"
https://www.rumah123.com/properti/jakarta-barat/hos10817430/#qid~edb6f11f-458c-42fb-99e8-d33808edc921,Ip2495 Rumah Furnished Lokasi Bagus Kavling Polri Jelambar,2500000000.0,"Harapan Indah, Bekasi",Harapan Indah,Jakarta Barat,3.0,3.0,84.0,180.0,SHM,2200.0,4.0,3.0,"Kitchen Set,  AC, AC, Wastafel, Tempat Jemuran, Keamanan"
https://www.rumah123.com/properti/jakarta-barat/hos11097111/#qid~edb6f11f-458c-42fb-99e8-d33808edc921,Dhyana Rumah Kos Baru Uk 8x17m Lokasi Bagus di Jelambar,5500000000.0,"Bojong Gede, Bogor",Bojong Gede,Jakarta Barat,10.0,11.0,136.0,336.0,SHM,0.0,4.0,4.0,Jalur Telepon
https://www.rumah123.com/properti/jakarta-barat/hos9898779/#qid~6371fe72-0c80-48c5-9e03-8a963c768f27,Rumah Strategis Kavling Polri Jelambar,1590000000.0,"Bekasi Utara, Bekasi",Bekasi Utara,Jakarta Barat,3.0,3.0,39.0,110.0,SHM,2200.0,5.0,3.0,"Tempat Jemuran, Wastafel"
https://www.rumah123.com/properti/jakarta-barat/hos11296981/#qid~e32c9ddd-06d7-4b93-8767-2f23284b5d4b,Chandra Rumah Bagus Uk 6x14m di Komplek Dutamas,2400000000.0,"Cinere, Depok",Cinere,Jakarta Barat,3.0,2.0,84.0,185.0,SHM,2200.0,4.0,3.0,Jalur Telepon
https://www.rumah123.com/properti/jakarta-barat/hos11289081/#qid~7840b3c9-e76e-4907-8328-f781e1b9345a,Chandra Rumah Uk 4x25m Lokasi Bagus di Komplek Kavling Polri,4300000000.0,"Tomang, Jakarta Barat",Tomang,Jakarta Barat,4.0,5.0,102.0,294.0,SHM,0.0,4.0,3.0,Tempat Jemuran
https://www.rumah123.com/properti/jakarta-barat/hos11350436/#qid~95c2dbe0-3d2b-44fe-a420-a91f0bc65674,Chandra Rumah Bagus Uk 7x20m Komplek Grawisa Jelambar,3750000000.0,"Menteng, Jakarta Pusat",Menteng,Jakarta Barat,4.0,4.0,140.0,210.0,SHM,0.0,4.0,2.0,Jalur Telepon
https://www.rumah123.com/properti/jakarta-barat/hos11069894/#qid~980b7c69-dce8-47fb-be84-b3f285b22af8,Chandra Rumah Uk 7x20m Shm Murni Lokasi Bagus di Komplek Dutamas,2750000000.0,"Green Lake City, Jakarta Barat",Green Lake City,Jakarta Barat,3.0,2.0,140.0,126.0,SHM,0.0,4.0,1.0,Jalur Telepon
https://www.rumah123.com/properti/jakarta-barat/hos11076754/#qid~980b7c69-dce8-47fb-be84-b3f285b22af8,Chandra Rumah Uk 8x21m di Jelambar Jakarta Barat,3100000000.0,"Kebayoran Baru, Jakarta Selatan",Kebayoran Baru,Jakarta Barat,3.0,3.0,168.0,236.0,SHM,0.0,4.0,2.0,Jalur Telepon
