url,title,price_in_rp,location,district,city,bedrooms,bathrooms,land_size_m2,building_size_m2,certificate,electricity_power,property_condition,floor_count,description
https://www.rumah123.com/properti/bogor/hos11359905/#qid~e056ee6a-d107-43d0-9a8c-2dccee850664,de'LORA @Parung Panjang ✅ LOKASI Strategis,749000000.0,"Jatibening, Bekasi",Jatibening,Bogor,3.0,1.0,72.0,48.0,Lainnya,2200.0,5.0,1.0,"Lapangan Voli,  Track Lari, Keamanan, Kolam Renang,  Tempat Gym, Wastafel,  Jogging Track, Lapangan Basket"
https://www.rumah123.com/properti/bogor/hos11359860/#qid~e056ee6a-d107-43d0-9a8c-2dccee850664,de'LORA @Parung Panjang ✅ LOKASI Strategis,674000000.0,"Margonda, Depok",Margonda,Bogor,2.0,1.0,72.0,39.0,Lainnya,2200.0,5.0,1.0," Track Lari,  Lapangan Voli, Keamanan, Kolam Renang, Lapangan Bulu Tangkis,  Tempat Gym, Wastafel,  Jogging Track, Lapangan Basket"
https://www.rumah123.com/properti/bogor/hos11359831/#qid~e056ee6a-d107-43d0-9a8c-2dccee850664,"de'LORA @Parung Panjang, Hunian Nyaman Nuansa Resortssn ✅ Lokasi strategi",516000000.0,"Jelambar, Jakarta Barat",Jelambar,Bogor,2.0,1.0,60.0,27.0,Lainnya,2200.0,5.0,1.0,"Lapangan Voli, Kolam Renang,  Tempat Gym, Wastafel, Keamanan, Lapangan Basket"
https://www.rumah123.com/properti/bogor/hos11359153/#qid~e056ee6a-d107-43d0-9a8c-2dccee850664,Rumah baru tanpa DP dekat stasiun parung panjang BSD Rumah di Dago kabasiran,516000000.0,"Cempaka Putih, Jakarta Pusat",Cempaka Putih,Bogor,2.0,1.0,60.0,27.0,HGB,2200.0,5.0,1.0," Kolam Renang, Keamanan 24 jam, Taman,  Track Lari,  Lapangan Voli, Jogging Track,  Playground, Lapangan Tenis,  Tempat Gym,  Keamanan,  One Gate System, Lapangan Basket"
https://www.rumah123.com/properti/bogor/hos11358688/#qid~476d06f5-e887-4bbe-b617-cf5782954f5c,"Rumah 2 lantai harga murah di pamulang, langsung pesan unitnya!",655000000.0,"Green Lake City, Jakarta Barat",Green Lake City,Bogor,3.0,2.0,64.0,60.0,SHM,1300.0,5.0,2.0," Taman,  Masjid, Jalur Telepon,  Track Lari,  Jalur Telepon, Kulkas,  AC, Jogging Track, Lapangan Bulu Tangkis, Wastafel,  Ac, Lapangan Bola, Tempat Jemuran, Keamanan"
https://www.rumah123.com/properti/bogor/hos11358503/#qid~476d06f5-e887-4bbe-b617-cf5782954f5c,Miliki hunian asri di cluster Alton millenium city,782000000.0,"Puri Indah, Jakarta Barat",Puri Indah,Bogor,2.0,2.0,60.0,61.0,HGB,2200.0,5.0,2.0,"Jalur Telepon,  Track Lari,  Jalur Telepon,  Lapangan Bulu Tangkis, Lapangan Tenis,  Tempat Laundry,  Lapangan Basket,  CCTV, Masjid,  One Gate System, Wastafel,  Playground, Lapangan Bola,  Jogging Track,  Kolam Renang, Taman, Keamanan 24 jam,  Taman,  Lapangan Voli,  Akses Parkir,  Tempat Gym,  Keamanan"
https://www.rumah123.com/properti/bogor/hos11357675/#qid~b2d78676-f2d8-4857-92e0-0db041e64cd8,Cluster Mora @De Lora Residence,460000000.0,"Kemang, Jakarta Selatan",Kemang,Bogor,2.0,1.0,27.0,60.0,Lainnya,1300.0,4.0,1.0," Kolam Renang, Taman,  Taman,  Masjid, Jalur Telepon,  Lapangan Basket, Lapangan Bola,  Lapangan Voli,  Track Lari, Kitchen Set,  Jalur Telepon,  Lapangan Bulu Tangkis,  Tempat Gym,  Keamanan, CCTV, Tempat Jemuran,  Jogging Track, Lapangan Tenis"
https://www.rumah123.com/properti/bogor/hos11288015/#qid~d93d15ce-3887-46a1-b0d4-ea88f4b51484,"Rumah Mewah Millenium City, Dekat Dengan Stasiun Parung Panjang",800000000.0,"Lebak Bulus, Jakarta Selatan",Lebak Bulus,Bogor,2.0,2.0,60.0,61.0,SHM,2200.0,5.0,1.0," Jogging Track, Track Lari,  Akses Parkir,  One Gate System, Masjid, Keamanan 24 jam,  Taman,  Tempat Laundry,  CCTV, Taman,  Playground,  Masjid, Keamanan"
https://www.rumah123.com/properti/bogor/hos11149080/#qid~a3b85dc6-9dd7-4fa9-9eac-113f4eba7868,Rumah Siap Huni Masih Baru SHM di The River Parung Panjang,475000000.0,"Batu Ceper, Tangerang",Batu Ceper,Bogor,2.0,1.0,72.0,36.0,SHM,1300.0,5.0,1.0,"Track Lari,  Taman, Taman, Jogging Track, Keamanan"
https://www.rumah123.com/properti/bogor/hos11147969/#qid~272f967a-f4a1-4288-9c59-3c41fb78d0d7,di Sentraland Paradise cluster Maldives blok C3/17 Rumah Bagus Selatan Lainnya,450000000.0,"BSD, Tangerang",BSD,Bogor,2.0,1.0,72.0,36.0,Lainnya,1300.0,4.0,1.0,"Lapangan Bola, Lapangan Tenis,  Kolam Renang, Masjid,  Lapangan Voli,  Lapangan Bulu Tangkis,  Taman,  Tempat Gym, Jogging Track,  Lapangan Basket,  Keamanan,  Track Lari"
https://www.rumah123.com/properti/bogor/hos11029522/#qid~af56dc88-5ef2-4c9f-90ad-830096747b0c,"Rumah Baru Siap Huni di Jl. Kabasiran, Parung Panjang",400000000.0,"Gading Serpong, Tangerang",Gading Serpong,Bogor,2.0,2.0,120.0,90.0,Lainnya,0.0,5.0,1.0,"Masjid, Taman"
https://www.rumah123.com/properti/bogor/hos10969304/#qid~72c0d0fa-15ed-44a4-9e30-a48cde4955c3,"Rumah Siap Huni Lebih Minimalis Dan Lebih Modern, Dp 10 Juta Langsung Akad",470000000.0,"BSD City, Tangerang",BSD City,Bogor,2.0,1.0,147.0,40.0,SHM,1300.0,5.0,1.0," AC, Taman,  Masjid, Jalur Telepon,  Keamanan"
https://www.rumah123.com/properti/bogor/hos10969303/#qid~72c0d0fa-15ed-44a4-9e30-a48cde4955c3,Ready Stock Cluster Minimalis Selangkah Ke Pusat Kota Bogor Dp 10 Jt All In,470000000.0,"Gading Serpong, Tangerang",Gading Serpong,Bogor,2.0,1.0,147.0,40.0,SHM,1300.0,5.0,1.0," Jalur Telepon,  AC, Masjid, Taman,  Keamanan"
https://www.rumah123.com/properti/bogor/hos10967646/#qid~597aa346-d86c-4080-8208-5b78189bc971,Rumah Subsidi Dekat Stasiun KRL Tenjo dan Dekat dengan tol,168000000.0,"Kebayoran Baru, Jakarta Selatan",Kebayoran Baru,Bogor,1.0,1.0,66.0,24.0,HGB,1300.0,5.0,1.0," Masjid,  Jogging Track, Keamanan, Taman"
https://www.rumah123.com/properti/bogor/hos10966845/#qid~4e914a46-aed0-47a8-8d6f-50d86614a720,Rumah Modern Murah 1 Lantai Siap Huni Dp 5jt,400000000.0,"Tebet, Jakarta Selatan",Tebet,Bogor,2.0,1.0,60.0,40.0,SHM,1300.0,5.0,1.0," Jalur Telepon,  Jogging Track,  AC, Masjid, Kolam Renang,  Taman,  CCTV,  Keamanan"
https://www.rumah123.com/properti/bogor/hos10966609/#qid~2a6d6b21-35af-4c85-8acd-d480cfa06f0b,Rumah Murah 2 Lantai Siap Huni Dp Cuma 5jt,400000000.0,"BSD, Tangerang",BSD,Bogor,2.0,1.0,60.0,40.0,SHM,1300.0,5.0,1.0," Jalur Telepon, AC,  Kolam Renang,  Taman,  CCTV, Jogging Track,  Masjid,  Keamanan"
https://www.rumah123.com/properti/bogor/hos10948823/#qid~cf8ff284-0056-4a74-ac46-3cccd475244e,Rumah 2 Lantai Exclusive Fasilitas Smart Home Bonus Kanopi Cantik,500000000.0,"Alam Sutera, Tangerang",Alam Sutera,Bogor,2.0,2.0,60.0,48.0,SHM,2200.0,4.0,1.0,"Keamanan 24 jam,  Taman,  Masjid, Jalur Telepon, Track Lari,  CCTV, Masjid,  AC,  Playground,  One Gate System,  Jogging Track, Keamanan, Lapangan Basket"
https://www.rumah123.com/properti/bogor/hos11359988/#qid~96043cfa-3f7c-4664-b753-477be50c4be7,Rumah 2 lantai asri siap huni di bogor kota SHM,1350000000.0,"Cipondoh, Tangerang",Cipondoh,Bogor,3.0,2.0,94.0,96.0,SHM,2200.0,5.0,2.0,"Taman,  Taman,  Masjid, Kitchen Set, Ac, Jogging Track, AC,  Keamanan, Track Lari, Tempat Jemuran"
https://www.rumah123.com/properti/bogor/hos11356146/#qid~9ab0b10c-8ceb-4c9a-9e7a-479f91a141d1,Rumah Minimalis Modern Termurah Ready Stock Dalam Cluster Cikeas Residence,619000000.0,"Gading Serpong, Tangerang",Gading Serpong,Bogor,2.0,1.0,90.0,36.0,SHM,1300.0,5.0,1.0," Pemanas Air, Jalur Telepon,  Track Lari,  Lapangan Bulu Tangkis,  Kolam Ikan, Lapangan Tenis,  Tempat Laundry,  Masjid,  Lapangan Basket,  CCTV, Masjid, Kitchen Set,  One Gate System, Wastafel,  Playground, Lapangan Bola,  Jogging Track,  Kolam Renang, Taman,  Taman, Keamanan 24 jam,  Lapangan Voli,  AC,  Akses Parkir,  Tempat Gym,  Keamanan,  Ac, Tempat Jemuran"
https://www.rumah123.com/properti/bogor/hos11288857/#qid~d93d15ce-3887-46a1-b0d4-ea88f4b51484,Rumah 2 kamar termurah model Scandinavian,551000000.0,"Bintaro, Tangerang Selatan",Bintaro,Bogor,2.0,1.0,70.0,36.0,SHM,1300.0,5.0,1.0," Jalur Telepon, Tempat Jemuran, Lapangan Bola,  Akses Parkir,  One Gate System, Masjid, Keamanan 24 jam,  Taman,  Tempat Laundry,  CCTV,  Playground, Wastafel, Jalur Telepon, Keamanan, Lapangan Basket"
https://www.rumah123.com/properti/bogor/hos11288012/#qid~d93d15ce-3887-46a1-b0d4-ea88f4b51484,Rumah model Scandinavian termurah di dekat tol cimanggis,551000000.0,"Bintaro, Tangerang Selatan",Bintaro,Bogor,2.0,1.0,70.0,36.0,SHM,1300.0,5.0,1.0,"Tempat Jemuran, Lapangan Bola,  Taman, Wastafel,  Masjid, CCTV, Jalur Telepon,  Keamanan, Lapangan Basket"
https://www.rumah123.com/properti/bogor/hos11217959/#qid~1780eca2-7720-4ae8-8fbf-7358a8ba7df9,Rumah Scandinavian style cicilan murah di Cikeas residence,551000000.0,"Citraland, Surabaya",Citraland,Bogor,2.0,1.0,70.0,36.0,SHM,1300.0,5.0,1.0," Jalur Telepon, Masjid,  CCTV, Wastafel, AC, Jalur Telepon, Tempat Jemuran, Lapangan Bola,  Akses Parkir,  One Gate System, Keamanan 24 jam,  Taman,  Tempat Laundry, Ac,  Playground,  Masjid,  Keamanan, Lapangan Basket, Jogging Track,  Track Lari"
https://www.rumah123.com/properti/bogor/hos11148557/#qid~c4d44eb1-084a-4a56-ac83-c2d53c7e711d,Rumah Taman Posisi Hook Dalam Cluster di Cikeas Residence Dekat Toll dan LRT Cimanggis Depok,908000000.0,"Citraland, Surabaya",Citraland,Bogor,2.0,1.0,125.0,48.0,SHM,1300.0,5.0,1.0," Jalur Telepon,  Jogging Track, Track Lari,  Taman, Ac, Taman, AC,  Masjid, CCTV, Jalur Telepon,  Keamanan"
https://www.rumah123.com/properti/bogor/hos11148269/#qid~c4d44eb1-084a-4a56-ac83-c2d53c7e711d,RUMAH SIAP HUNI DEKAT STASIUN LRT LOKASI DI CIKEAS,651000000.0,"Sunter, Jakarta Utara",Sunter,Bogor,2.0,1.0,84.0,45.0,SHM,1300.0,5.0,1.0," Ac,  Jogging Track, Track Lari, Masjid, Keamanan 24 jam,  Taman, Taman, AC, Keamanan"
https://www.rumah123.com/properti/bogor/hos11148259/#qid~c4d44eb1-084a-4a56-ac83-c2d53c7e711d,RUMAH MEWAH HARGA TERMURAH DI CIKEAS SERTIFIKAT SHM,651000000.0,"Pantai Mutiara, Jakarta Utara",Pantai Mutiara,Bogor,2.0,1.0,84.0,45.0,SHM,1300.0,5.0,1.0," Ac,  Jogging Track, Track Lari, Masjid,  Taman, Taman, AC, Keamanan"
https://www.rumah123.com/properti/bogor/hos11148252/#qid~c4d44eb1-084a-4a56-ac83-c2d53c7e711d,CLUSTER SIAP HUNI DI CIKEAS CICILAN 2 JUTAAN SERTIFIKAT SHM,651000000.0,"Citraland, Surabaya",Citraland,Bogor,2.0,1.0,84.0,45.0,SHM,1300.0,5.0,1.0," Jogging Track, Track Lari,  Taman, Ac, Taman, AC,  Masjid, Keamanan"
https://www.rumah123.com/properti/bogor/hos11148247/#qid~c4d44eb1-084a-4a56-ac83-c2d53c7e711d,RUMAH SIAP HUNI TERMURAH DI CIKEAS SERTIFIKAT SHM,651000000.0,"Sunter, Jakarta Utara",Sunter,Bogor,2.0,1.0,84.0,45.0,SHM,1300.0,5.0,1.0," Jogging Track, Track Lari, Masjid, Keamanan 24 jam,  Taman, Ac, Taman, AC,  Masjid,  Keamanan"
https://www.rumah123.com/properti/bogor/hos11148224/#qid~c4d44eb1-084a-4a56-ac83-c2d53c7e711d,RUMAH STRATEGIS SIAP HUNI DI CIKEAS SERTIFIKAT SHM,651000000.0,"Kemang, Jakarta Selatan",Kemang,Bogor,2.0,1.0,84.0,45.0,SHM,1300.0,5.0,1.0,"AC,  Ac, Track Lari, Masjid, Keamanan 24 jam,  Taman, Taman, Jogging Track,  Keamanan"
https://www.rumah123.com/properti/bogor/hos11145351/#qid~54f11cc9-2116-4dce-8595-8d24deadae2e,Rumah 2 Lantai Termurah Promo Khusus September Ceria di Cikeas,1070000000.0,"Pantai Indah Kapuk 2, Jakarta Utara",Pantai Indah Kapuk 2,Bogor,3.0,3.0,84.0,95.0,SHM,2200.0,5.0,1.0," Jogging Track, Track Lari,  Taman,  CCTV, Ac, Taman, AC,  Masjid, CCTV, Jalur Telepon,  Keamanan"
https://www.rumah123.com/properti/bogor/hos11145034/#qid~98005c5e-d32a-4f8a-9887-67d8eb6e3b65,RUMAH STRATEGIS SIAP HUNI DI CIKEAS SERTIFIKAT SHM,535000000.0,"Cipayung, Jakarta Timur",Cipayung,Bogor,2.0,1.0,70.0,36.0,SHM,1300.0,5.0,1.0," Jogging Track, Track Lari, Masjid, Keamanan 24 jam,  Taman, Ac, Taman, AC,  Masjid,  Keamanan"
https://www.rumah123.com/properti/bogor/hos11145029/#qid~98005c5e-d32a-4f8a-9887-67d8eb6e3b65,RUMAH DIJUAL SIAP HUNI DI CIKEAS SERTIFIKAT SHM,535000000.0,"Jati Asih, Bekasi",Jati Asih,Bogor,2.0,1.0,70.0,36.0,SHM,1300.0,5.0,1.0," Jogging Track, Track Lari, Ac, Taman, AC,  Masjid,  Keamanan"
https://www.rumah123.com/properti/bogor/hos11145027/#qid~98005c5e-d32a-4f8a-9887-67d8eb6e3b65,RUMAH DI JAMIN TIDAK BANJIR LOKASI DI CIKEAS SERTIFIKAT SHM,535000000.0,"Joglo, Jakarta Barat",Joglo,Bogor,2.0,1.0,70.0,36.0,SHM,1300.0,5.0,1.0," Jogging Track, Track Lari, Ac, Taman, AC,  Masjid,  Keamanan"
https://www.rumah123.com/properti/bogor/hos11089228/#qid~98005c5e-d32a-4f8a-9887-67d8eb6e3b65,Rumah SHM Baru free biaya KPR,551000000.0,"Cempaka Putih, Jakarta Pusat",Cempaka Putih,Bogor,2.0,1.0,70.0,36.0,SHM,1300.0,5.0,1.0," Jalur Telepon,  Ac,  Jogging Track, Taman,  Masjid, CCTV,  Keamanan"
https://www.rumah123.com/properti/bogor/hos11089135/#qid~98005c5e-d32a-4f8a-9887-67d8eb6e3b65,Rumah Baru sudah SHM free biaya KPR,551000000.0,"Tangerang, Tangerang",Tangerang,Bogor,2.0,1.0,70.0,36.0,SHM,1300.0,5.0,1.0," Jalur Telepon,  Taman,  CCTV, Ac, Jogging Track,  Masjid,  Keamanan"
https://www.rumah123.com/properti/bogor/hos11089036/#qid~98005c5e-d32a-4f8a-9887-67d8eb6e3b65,Rumah type baru model Scandinavian,551000000.0,"Bintaro, Tangerang Selatan",Bintaro,Bogor,2.0,1.0,70.0,36.0,SHM,1300.0,5.0,1.0," Ac,  Jogging Track,  CCTV, Taman,  Masjid, Jalur Telepon,  Keamanan"
https://www.rumah123.com/properti/bogor/hos10969659/#qid~19ab7020-3244-4dca-8bce-6938bbe362d5,Rumah murah promo di akhir Agustus,661000000.0,"Bintaro, Tangerang Selatan",Bintaro,Bogor,2.0,1.0,84.0,40.0,SHM,1300.0,5.0,1.0," Jalur Telepon,  Taman,  CCTV, Ac, Jogging Track,  Masjid,  Keamanan"
https://www.rumah123.com/properti/bogor/hos10969407/#qid~72c0d0fa-15ed-44a4-9e30-a48cde4955c3,Rumah 2 lantai siap huni sudah SHM,1160000000.0,"Semarang Timur, Semarang",Semarang Timur,Bogor,3.0,3.0,84.0,95.0,SHM,2200.0,5.0,1.0," Jalur Telepon,  Ac, Masjid,  Taman,  CCTV, Jogging Track,  Keamanan"
https://www.rumah123.com/properti/bogor/hos10969402/#qid~72c0d0fa-15ed-44a4-9e30-a48cde4955c3,Rumah Minimalis Siap Huni Dalam Cluster Posisi Hook Dekat Toll dan LRT Cimanggis,921000000.0,"Pamulang, Tangerang Selatan",Pamulang,Bogor,2.0,1.0,125.0,48.0,SHM,1300.0,5.0,1.0," Ac,  Jogging Track,  CCTV, Taman,  Masjid, Jalur Telepon,  Keamanan"
https://www.rumah123.com/properti/bogor/hos10969272/#qid~72c0d0fa-15ed-44a4-9e30-a48cde4955c3,Rumah Murah Siap Huni di Cikeas Bogor,500000000.0,"Pamulang, Tangerang Selatan",Pamulang,Bogor,2.0,1.0,72.0,36.0,SHM,1300.0,5.0,1.0," Jalur Telepon,  Jogging Track,  Taman,  CCTV, Ac,  Masjid, Keamanan"
https://www.rumah123.com/properti/bogor/hos10967485/#qid~597aa346-d86c-4080-8208-5b78189bc971,"Cibubur country, rumah unt milenial..siap huni",650000000.0,"Sunter, Jakarta Utara",Sunter,Bogor,2.0,1.0,90.0,51.0,SHM,1300.0,4.0,1.0," Jogging Track, Track Lari, Masjid, Keamanan 24 jam,  Taman, Ac, Taman, AC,  Masjid,  Keamanan"
https://www.rumah123.com/properti/bogor/hos10912648/#qid~2c2d6363-6929-4d95-b726-fdfad6023d0e,Rumah Baru di Jln Cikeas residence sudah SHM,551000000.0,"BSD City, Tangerang",BSD City,Bogor,2.0,1.0,70.0,36.0,SHM,1300.0,5.0,1.0," Jalur Telepon,  Ac,  Jogging Track, Taman,  Masjid, CCTV,  Keamanan"
https://www.rumah123.com/properti/bogor/hos10911323/#qid~2c2d6363-6929-4d95-b726-fdfad6023d0e,Rumah hook minimalis dicikeas residence,980000000.0,"Alam Sutera, Tangerang",Alam Sutera,Bogor,2.0,1.0,125.0,48.0,SHM,1300.0,5.0,1.0," Jalur Telepon,  Taman,  CCTV, Ac, Jogging Track,  Masjid,  Keamanan"
https://www.rumah123.com/properti/bogor/hos11355504/#qid~fa3659e0-f6c9-465a-87c6-b2954e6873e6,Hunian Eksklusif Lokasi Strategis Dekat Pusat Kota Tangsel,655000000.0,"Citraland, Surabaya",Citraland,Bogor,3.0,2.0,64.0,60.0,SHM,1300.0,5.0,2.0,"Keamanan 24 jam,  Taman, Jalur Telepon,  Track Lari, Masjid, Kulkas,  AC,  Akses Parkir,  Playground, Lapangan Bulu Tangkis, Wastafel,  One Gate System, Lapangan Bola, Tempat Jemuran,  Tempat Laundry"
https://www.rumah123.com/properti/bogor/hos11246452/#qid~8765a152-2e9c-430b-9609-a132f2d92374,GRAND DUTA CITY SHM,800000000.0,"Citraland, Surabaya",Citraland,Bogor,2.0,1.0,60.0,42.0,SHM,2200.0,5.0,1.0," Pemanas Air, Jalur Telepon,  Track Lari,  Jalur Telepon,  Lapangan Bulu Tangkis,  Kolam Ikan,  Kitchen Set, Keamanan,  Tempat Laundry, Lapangan Tenis,  Lapangan Basket,  Mesin Cuci,  CCTV, Masjid, Kulkas,  One Gate System, Wastafel,  Playground, Lapangan Bola,  Jogging Track,  Kolam Renang, Keamanan 24 jam,  Taman,  Lapangan Voli,  AC,  Akses Parkir,  Tempat Gym,  Ac, Tempat Jemuran"
https://www.rumah123.com/properti/bogor/hos10938325/#qid~20a63da3-019d-49d6-a399-ca8802682231,Rumah Cantik Minimalist Siap Huni Di Parung Bogor,1200000000.0,"BSD City, Tangerang",BSD City,Bogor,3.0,2.0,165.0,74.0,SHM,2200.0,5.0,2.0," Taman, Masjid,  Jalur Telepon,  Keamanan,  Ac, CCTV,  Jogging Track"
https://www.rumah123.com/properti/bogor/hos10937852/#qid~20a63da3-019d-49d6-a399-ca8802682231,"Rumah Bagus Cozy di Parung Bogor, Dekat Tol Desari",700000000.0,"BSD City, Tangerang",BSD City,Bogor,3.0,2.0,68.0,62.0,SHM,2200.0,5.0,2.0," Taman,  Masjid, Jalur Telepon, Ac,  Keamanan,  Jogging Track"
https://www.rumah123.com/properti/bogor/hos11360024/#qid~ba512aae-34bf-491d-b55f-70e2bd4c3bac,Dijual rumah siap huni di lokasi strategis kota bogor SHM,1350000000.0,"Kemang, Jakarta Selatan",Kemang,Bogor,3.0,2.0,94.0,96.0,SHM,2200.0,5.0,1.0," Masjid, Kitchen Set, Kolam Ikan, Jogging Track, AC,  AC,  Keamanan, Track Lari, Wastafel"
https://www.rumah123.com/properti/bogor/hos11360865/#qid~f2ce3966-fc86-4c27-9a96-a48ab8055f9d,Rumah Elegan 2 Lantai include  Biaya Biaya Surat Lokasi Strategis,685000000.0,"Jakarta Garden City, Jakarta Timur",Jakarta Garden City,Bogor,3.0,2.0,64.0,60.0,SHM,1300.0,5.0,2.0,"Keamanan 24 jam,  Taman, Jalur Telepon, Masjid,  Jalur Telepon, Jogging Track,  Akses Parkir,  Keamanan,  One Gate System, Track Lari, Tempat Jemuran"
https://www.rumah123.com/properti/bogor/hos11359201/#qid~e056ee6a-d107-43d0-9a8c-2dccee850664,Rumah immpian di cluster dalton millenial 1 dimillennium city,514000000.0,"Cipondoh, Tangerang",Cipondoh,Bogor,2.0,1.0,60.0,22.0,HGB,2200.0,5.0,1.0," Kolam Renang, Taman,  Masjid, Jalur Telepon,  Lapangan Basket,  Lapangan Voli,  Track Lari,  Tempat Gym,  Keamanan, Lapangan Bola, Wastafel,  Jogging Track, Lapangan Tenis"
https://www.rumah123.com/properti/bogor/hos11358767/#qid~476d06f5-e887-4bbe-b617-cf5782954f5c,Miliki hunian modern di cluster carlton millenium city,798000000.0,"BSD, Tangerang",BSD,Bogor,3.0,2.0,72.0,70.0,HGB,2200.0,5.0,2.0," Kolam Renang, Taman,  Taman,  Masjid, Jalur Telepon,  Lapangan Basket,  Lapangan Voli,  Track Lari,  Lapangan Bulu Tangkis, Jogging Track,  Tempat Gym,  Keamanan, Lapangan Bola, Lapangan Tenis"
https://www.rumah123.com/properti/bogor/hos11355580/#qid~9ab0b10c-8ceb-4c9a-9e7a-479f91a141d1,Biarpun over kredit yang penting bisa punya rumah dimna pun adanya,75000000.0,"Lippo Karawaci, Tangerang",Lippo Karawaci,Bogor,2.0,1.0,60.0,30.0,SHM,900.0,4.0,1.0,"Keamanan 24 jam,  Taman, Masjid, Keamanan"
https://www.rumah123.com/properti/bogor/hos11220207/#qid~1780eca2-7720-4ae8-8fbf-7358a8ba7df9,Rumah di Parung Cuma 5jt Bisa Proses KPR dan Free Biaya-biaya,455000000.0,"Cilandak, Jakarta Selatan",Cilandak,Bogor,2.0,1.0,65.0,36.0,SHM,1300.0,5.0,1.0," Jalur Telepon, Tempat Jemuran, Masjid, Wastafel, Jalur Telepon, Keamanan"
https://www.rumah123.com/properti/bogor/hos11219636/#qid~1780eca2-7720-4ae8-8fbf-7358a8ba7df9,RUMAH DESIGN AMERICAN MILLENNIUM  CITY,931000000.0,"Kebagusan, Jakarta Selatan",Kebagusan,Bogor,2.0,2.0,60.0,72.0,SHM,2200.0,4.0,2.0,"Tempat Jemuran, Track Lari,  Akses Parkir,  One Gate System, Tempat Gym, Masjid, Keamanan 24 jam,  Taman, Taman,  Playground, Jogging Track,  Masjid,  Keamanan"
https://www.rumah123.com/properti/bogor/hos11086680/#qid~4f3f9ada-f39c-486d-9741-b8c8024d07d4,"Rumah Elegant, Murah dan Strategis di Parung, Bogor",410000000.0,"Duren Sawit, Jakarta Timur",Duren Sawit,Bogor,2.0,1.0,60.0,36.0,SHM,1300.0,5.0,1.0," Jogging Track,  Taman, Ac,  Masjid, Jalur Telepon,  Keamanan"
https://www.rumah123.com/properti/bogor/hos10969677/#qid~19ab7020-3244-4dca-8bce-6938bbe362d5,Rumah Siap Huni di Cluster Jepang Akses Tol & Bebas Banjir,900000000.0,"Sleman, Yogyakarta",Sleman,Bogor,3.0,2.0,70.0,90.0,SHM,2200.0,5.0,2.0," Jalur Telepon,  Ac, AC, Track Lari,  Kolam Renang, Masjid, Keamanan 24 jam,  Taman, Kolam Renang,  CCTV, Jogging Track, CCTV, Jalur Telepon,  Keamanan"
https://www.rumah123.com/properti/bogor/hos10877115/#qid~72c0d0fa-15ed-44a4-9e30-a48cde4955c3,Rumah siap huni d parung,440000000.0,"Jagakarsa, Jakarta Selatan",Jagakarsa,Bogor,2.0,1.0,61.0,40.0,SHM,1300.0,5.0,1.0," Jalur Telepon, Taman,  Masjid, CCTV,  Keamanan"
https://www.rumah123.com/properti/bogor/hos10969306/#qid~72c0d0fa-15ed-44a4-9e30-a48cde4955c3,Promo Millennial Khusus 3 Unit Pertama Dp 10 Jt Langsung Akad Siap Huni,470000000.0,"Pondok Indah, Jakarta Selatan",Pondok Indah,Bogor,2.0,1.0,147.0,40.0,SHM,1300.0,5.0,1.0," AC, Taman,  Masjid, Jalur Telepon,  Keamanan"
https://www.rumah123.com/properti/bogor/hos10969305/#qid~72c0d0fa-15ed-44a4-9e30-a48cde4955c3,Modal 10 Juta Langsung Punya Rumah Minimalis Akses Terbaik Dekat Stasiun,470000000.0,"BSD, Tangerang",BSD,Bogor,2.0,1.0,147.0,40.0,SHM,1300.0,5.0,1.0," Jalur Telepon,  Taman, AC,  Masjid, Keamanan"
https://www.rumah123.com/properti/bogor/hos10966851/#qid~4e914a46-aed0-47a8-8d6f-50d86614a720,Rumah Murah Mewah 1 Lantai Siap Huni,466000000.0,"BSD, Tangerang",BSD,Bogor,2.0,1.0,60.0,40.0,SHM,1300.0,5.0,1.0," Jalur Telepon,  AC,  Kolam Renang,  Taman,  CCTV, Jogging Track,  Masjid, Keamanan"
https://www.rumah123.com/properti/bogor/hos10966605/#qid~2a6d6b21-35af-4c85-8acd-d480cfa06f0b,Rumah Murah 2 Lantai Siap Huni Dp Cuma 5jt,400000000.0,"Sunter, Jakarta Utara",Sunter,Bogor,2.0,1.0,60.0,40.0,SHM,1300.0,5.0,1.0," Jalur Telepon,  AC, Kolam Renang,  Taman,  CCTV, Jogging Track,  Masjid,  Keamanan"
https://www.rumah123.com/properti/bogor/hos10966205/#qid~2a6d6b21-35af-4c85-8acd-d480cfa06f0b,Rumah Murah 5jt All In 1 Lantai Siap Huni,400000000.0,"Kelapa Gading, Jakarta Utara",Kelapa Gading,Bogor,2.0,1.0,60.0,40.0,SHM,1300.0,5.0,1.0,"Tempat Jemuran,  Jogging Track, Track Lari,  Akses Parkir,  One Gate System,  Kolam Renang, Masjid, Keamanan 24 jam,  Taman,  Tempat Laundry,  CCTV, Taman,  Playground, Wastafel,  Masjid, Jalur Telepon,  Keamanan"
https://www.rumah123.com/properti/bogor/hos10964356/#qid~2c2d6363-6929-4d95-b726-fdfad6023d0e,Rumah Murah 2 Lantai Hunian Masakini Siap Huni,800000000.0,"Sagulung, Batam",Sagulung,Bogor,3.0,2.0,70.0,60.0,SHM,2200.0,5.0,2.0," Jogging Track,  Kolam Renang,  Taman,  Masjid, CCTV, Jalur Telepon,  Keamanan"
https://www.rumah123.com/properti/bogor/hos10964368/#qid~2c2d6363-6929-4d95-b726-fdfad6023d0e,Rumah Murah Hunian Masakini 2 Lantai Siap Huni,750000000.0,"Pasirmulya, Bogor",Pasirmulya,Bogor,3.0,2.0,70.0,60.0,SHM,2200.0,5.0,2.0," Jogging Track,  Kolam Renang,  Taman,  Masjid, CCTV, Jalur Telepon,  Keamanan"
https://www.rumah123.com/properti/bogor/hos10888111/#qid~fa3659e0-f6c9-465a-87c6-b2954e6873e6,"Pesona Cilebut 2, Bogor, Strategis, Siap Huni, Bagus,  Cepat",450000000.0,"Summarecon Bekasi, Bekasi",Summarecon Bekasi,Bogor,2.0,1.0,72.0,36.0,SHM,1300.0,3.0,1.0," Taman, Masjid, Keamanan"
https://www.rumah123.com/properti/bogor/hos11159745/#qid~20a63da3-019d-49d6-a399-ca8802682231,Murah Di Pesona Cilebut Dekat Stasiun Rumah Cantik,390000000.0,"Sentul City, Bogor",Sentul City,Bogor,2.0,1.0,72.0,45.0,SHM,1300.0,4.0,1.0," Taman, Jalur Telepon,  Track Lari,  Jalur Telepon, Jogging Track, Lapangan Bulu Tangkis, Wastafel, Tempat Jemuran, Keamanan, Lapangan Basket"
https://www.rumah123.com/properti/bogor/hos11360019/#qid~e056ee6a-d107-43d0-9a8c-2dccee850664,Rumah satu lantai dekat sts Cilebut,400000000.0,"Sentul, Bogor",Sentul,Bogor,2.0,1.0,72.0,36.0,SHM,1300.0,5.0,1.0," Taman, Jalur Telepon,  Track Lari,  CCTV, Masjid,  Jalur Telepon, Keamanan,  AC, Lapangan Bulu Tangkis, Wastafel,  Ac, Pemanas Air, Tempat Jemuran,  Jogging Track, Lapangan Basket"
https://www.rumah123.com/properti/bogor/hos11358270/#qid~476d06f5-e887-4bbe-b617-cf5782954f5c,"Rumah Ready di Cilebut, Bogor",330000000.0,"Sentul City, Bogor",Sentul City,Bogor,2.0,1.0,72.0,60.0,SHM,1300.0,4.0,1.0,"Masjid, Lapangan Voli"
https://www.rumah123.com/properti/bogor/hos11357947/#qid~25cd513f-2434-41fc-86dd-6c810c0bdb94,Rumah dijual dua juta langsung akad di Cilebut Bogor Jawa barat,300000000.0,"Kota Wisata, Bogor",Kota Wisata,Bogor,2.0,1.0,72.0,60.0,SHM,1300.0,4.0,1.0,"Taman, Keamanan 24 jam,  Taman,  Masjid,  Lapangan Voli, Masjid,  Lapangan Bulu Tangkis,  Akses Parkir,  Playground, Lapangan Bola, Tempat Jemuran, Keamanan, Lapangan Basket"
https://www.rumah123.com/properti/bogor/hos11356077/#qid~9ab0b10c-8ceb-4c9a-9e7a-479f91a141d1,Jual rumah murah si kawasan cilebut tanpa kredit,265000000.0,"Cibinong, Bogor",Cibinong,Bogor,2.0,1.0,67.0,36.0,SHM,900.0,5.0,1.0,"Akses Parkir, Masjid"
https://www.rumah123.com/properti/bogor/hos11355861/#qid~9ab0b10c-8ceb-4c9a-9e7a-479f91a141d1,Cluster Eksklusif Dekat Stasiun Cilebut Bogor,499000000.0,"Sentul City, Bogor",Sentul City,Bogor,3.0,2.0,66.0,41.0,SHM,1300.0,5.0,2.0,"Taman, Keamanan"
https://www.rumah123.com/properti/bogor/hos11287264/#qid~af04e686-fd14-481d-bf77-d69add63cd32,Rumah Minimalis Modern 10mnt Dari Stasiun Citayam,225000000.0,"Bekasi Utara, Bekasi",Bekasi Utara,Bogor,2.0,1.0,60.0,36.0,SHM,1300.0,5.0,1.0,"Taman,  CCTV, Keamanan 24 jam,  One Gate System"
https://www.rumah123.com/properti/bogor/hos11287946/#qid~d93d15ce-3887-46a1-b0d4-ea88f4b51484,Rumah di Komplek pwi jaya cilebut 3 Lantai,2700000000.0,"Jatibening, Bekasi",Jatibening,Bogor,5.0,5.0,180.0,450.0,SHM,2200.0,4.0,3.0," Ac,  Kolam Renang, Masjid, Keamanan 24 jam, Kolam Renang,  Taman, Taman, AC,  Masjid, CCTV,  Keamanan"
https://www.rumah123.com/properti/bogor/hos11027117/#qid~19ab7020-3244-4dca-8bce-6938bbe362d5,Rumah taman griya asri cilebut,300000000.0,"Kalideres, Jakarta Barat",Kalideres,Bogor,3.0,1.0,72.0,45.0,SHM,0.0,4.0,1.0," Jalur Telepon,  Jogging Track,  Kolam Renang,  Taman,  CCTV, Ac,  Masjid, Keamanan"
https://www.rumah123.com/properti/bogor/hos10969297/#qid~72c0d0fa-15ed-44a4-9e30-a48cde4955c3,Rumah Modern Design Baru Dekat St Cilebut Dp 10 Juta Langsung Akad Langsung Huni,470000000.0,"Cimanggis, Depok",Cimanggis,Bogor,2.0,1.0,147.0,40.0,SHM,1300.0,5.0,1.0," Jalur Telepon, Taman, AC,  Masjid,  Keamanan"
