url,title,price_in_rp,location,district,city,bedrooms,bathrooms,land_size_m2,building_size_m2,certificate,electricity_power,property_condition,floor_count,description
https://www.rumah123.com/properti/bogor/hos9554068/#qid~e175c33b-d42f-4cad-aed9-00c9c7a2cccb,Rumah minimalis best view dekat Jungleland Sentul City Bogor,900000000.0,"Cibubur, Jakarta Timur",Cibubur,Bogor,2.0,1.0,90.0,90.0,SHM,0.0,5.0,2.0,"Taman,  Masjid, Jalur Telepon,  Keamanan,  Jogging Track"
https://www.rumah123.com/properti/bogor/hos11070962/#qid~e175c33b-d42f-4cad-aed9-00c9c7a2cccb,Rumah murah di sentul city view gunung,850000000.0,"Pamulang, Tangerang Selatan",Pamulang,Bogor,3.0,2.0,139.0,130.0,SHM,2200.0,5.0,1.0," Taman, Masjid,  Jalur Telepon, Jogging Track,  Keamanan"
https://www.rumah123.com/properti/bogor/hos9021779/#qid~e175c33b-d42f-4cad-aed9-00c9c7a2cccb,Rumah baru renovasi disentul city,650000000.0,"Sunter, Jakarta Utara",Sunter,Bogor,2.0,2.0,90.0,100.0,SHM,2200.0,3.0,1.0,"Taman,  Masjid, Jalur Telepon,  Keamanan,  Jogging Track"
https://www.rumah123.com/properti/bogor/hos11259267/#qid~4db3177c-d51e-43c0-8995-7cc0c12524a6,Rumah Minimalis Sudah Renovasi Sentul Alaya Sentul City Bogor,1300000000.0,"Pondok Indah, Jakarta Selatan",Pondok Indah,Bogor,2.0,1.0,150.0,62.0,SHM,2200.0,4.0,1.0,"Taman, Keamanan 24 jam,  CCTV,  One Gate System, Tempat Jemuran"
https://www.rumah123.com/properti/bogor/hos11144403/#qid~8765a152-2e9c-430b-9609-a132f2d92374,"Rumah Di Cluster Terdepan Strategis, Dekat Aeon Mall Akses Toll Sentul City",2150000000.0,"Bintaro, Tangerang Selatan",Bintaro,Bogor,2.0,4.0,216.0,110.0,SHM,3300.0,3.0,1.0,"Taman,  Kolam Renang, Keamanan 24 jam,  Taman,  Lapangan Basket,  Track Lari,  Lapangan Voli, Masjid,  Lapangan Bulu Tangkis, Kolam Renang,  Playground,  Tempat Gym,  One Gate System, Lapangan Bola, Lapangan Tenis"
https://www.rumah123.com/properti/bogor/hos11166281/#qid~8765a152-2e9c-430b-9609-a132f2d92374,"Rumah Minimalis 2 Lantai Jual Murah, posisi depan taman, View Pegunungan, Sentul City",3500000000.0,"BSD City, Tangerang",BSD City,Bogor,4.0,4.0,323.0,500.0,SHM,4400.0,4.0,2.0,"Taman, AC,  Keamanan"
https://www.rumah123.com/properti/bogor/hos8957574/#qid~8765a152-2e9c-430b-9609-a132f2d92374,Rumah Sangat Murah Samping Ahpoong,1300000000.0,"Pejaten, Jakarta Selatan",Pejaten,Bogor,5.0,3.0,117.0,160.0,SHM,3500.0,4.0,2.0," Taman, Masjid,  Jalur Telepon, Kolam Renang,  Keamanan,  Ac,  Jogging Track"
https://www.rumah123.com/properti/bogor/hos11113948/#qid~8765a152-2e9c-430b-9609-a132f2d92374,Rumah Sangat Murah di Jungle Land,1250000000.0,"BSD, Tangerang",BSD,Bogor,3.0,2.0,144.0,105.0,Lainnya,2200.0,4.0,2.0," Kolam Renang, Taman,  Masjid, Jalur Telepon,  Keamanan,  Jogging Track"
https://www.rumah123.com/properti/bogor/hos11111187/#qid~8765a152-2e9c-430b-9609-a132f2d92374,Di  Rumah di Pintu Tol cireureup SHM,700000000.0,"BSD, Tangerang",BSD,Bogor,2.0,1.0,137.0,40.0,SHM,1300.0,5.0,1.0,"Taman, Jogging Track,  Masjid,  Keamanan"
https://www.rumah123.com/properti/bogor/hos11149100/#qid~20a63da3-019d-49d6-a399-ca8802682231,"Rumah 2 Lantai Unfurnished di Sentul City, Bogor",4500000000.0,"Citra Garden, Jakarta Barat",Citra Garden,Bogor,3.0,2.0,358.0,250.0,HGB,3500.0,5.0,2.0,"Taman, Track Lari, Wastafel, Keamanan 24 jam"
https://www.rumah123.com/properti/bogor/hos11105814/#qid~20a63da3-019d-49d6-a399-ca8802682231,"Rumah Minimalis Modern,rmh Murah,rumah Mewah,rumah Siap Huni,di Sentul City Bogor Ja bar",8500000000.0,"Green Lake City, Jakarta Barat",Green Lake City,Bogor,8.0,6.0,350.0,620.0,SHM,6600.0,4.0,4.0,"Keamanan 24 jam,  Taman, Jalur Telepon, Kitchen Set, Masjid,  AC,  Akses Parkir,  Playground, Wastafel,  One Gate System, Track Lari, Tempat Jemuran, Lapangan Basket"
https://www.rumah123.com/properti/bogor/hos9311091/#qid~20a63da3-019d-49d6-a399-ca8802682231,Cepat Rumah Murah Baru Bagus bebas polusi di Sentul Bogor,1900000000.0,"Kebayoran Baru, Jakarta Selatan",Kebayoran Baru,Bogor,3.0,2.0,126.0,102.0,SHM,2200.0,5.0,2.0," Jogging Track, Taman, Ac,  Keamanan"
https://www.rumah123.com/properti/bogor/hos10769518/#qid~20a63da3-019d-49d6-a399-ca8802682231,Rumah siap huni lokasi strategis harga murah sentul city,4500000000.0,"Pondok Labu, Jakarta Selatan",Pondok Labu,Bogor,4.0,3.0,663.0,300.0,HGB,2200.0,3.0,2.0," Kolam Renang,  Taman,  Masjid, Jalur Telepon,  AC,  Jogging Track, Keamanan"
https://www.rumah123.com/properti/bogor/hos11149550/#qid~20a63da3-019d-49d6-a399-ca8802682231,"Rumah Mewah Dengan Lift, Kolam Renang, Modern Classic, Sentul City",11500000000.0,"Jatisampurna, Bekasi",Jatisampurna,Bogor,4.0,5.0,518.0,515.0,HGB,5500.0,5.0,2.0," Kolam Renang, Taman, Keamanan 24 jam, Kolam Renang, Keamanan"
https://www.rumah123.com/properti/bogor/hos10679044/#qid~96043cfa-3f7c-4664-b753-477be50c4be7,"kolam Renang,hunian Para Sultan,view Gng Pancar,gng Gede,golf Higland,sangat Mewah Dan Bagus,harga Murah,di Cluster Sentul City Bogor Ja bar",18000000000.0,"Bekasi, Bekasi",Bekasi,Bogor,6.0,5.0,450.0,800.0,SHM,6600.0,5.0,3.0," Kolam Renang,  Pemanas Air,  Taman,  Kitchen Set,  Masjid, Jalur Telepon,  Mesin Cuci, Track Lari, Kulkas,  AC, Wastafel,  Keamanan,  Ac, CCTV, Tempat Jemuran,  Jogging Track"
https://www.rumah123.com/properti/bogor/hos11361074/#qid~96043cfa-3f7c-4664-b753-477be50c4be7,Rumah minimalis siap huni kota bogor SHM,1350000000.0,"Gunung Sindur, Bogor",Gunung Sindur,Bogor,3.0,2.0,94.0,96.0,SHM,2200.0,5.0,1.0,"Taman,  Masjid, Kitchen Set,  AC, AC,  Keamanan, Track Lari, Wastafel,  Jogging Track"
https://www.rumah123.com/properti/bogor/hos11342054/#qid~ba512aae-34bf-491d-b55f-70e2bd4c3bac,"Rumah 2 Lantai Minimalis, Lingkungan Sejuk, di Sentul City, Bogor",2500000000.0,"Kota Wisata, Bogor",Kota Wisata,Bogor,4.0,4.0,180.0,300.0,SHM,5500.0,4.0,2.0,"Taman, Keamanan 24 jam, Akses Parkir,  Taman,  CCTV, Kitchen Set,  AC,  Playground, Wastafel, Tempat Jemuran,  One Gate System,  Kolam Ikan"
https://www.rumah123.com/properti/bogor/hos11360351/#qid~f2ce3966-fc86-4c27-9a96-a48ab8055f9d,Jual Rumah Mewah View Bagus di Cluster Northridge Sentul City,30000000000.0,"Tarumajaya, Bekasi",Tarumajaya,Bogor,5.0,5.0,2786.0,1500.0,SHM,5500.0,4.0,2.0,"Keamanan 24 jam, Taman, Jalur Telepon,  CCTV,  Playground,  One Gate System, Track Lari"
https://www.rumah123.com/properti/bogor/hos11343660/#qid~f2ce3966-fc86-4c27-9a96-a48ab8055f9d,"Rumah Butuh Renovasi di Cluster Imperial, Sentul City Bogor",4500000000.0,"Summarecon Bekasi, Bekasi",Summarecon Bekasi,Bogor,3.0,2.0,575.0,200.0,Lainnya,2200.0,2.0,1.0,"Taman, Keamanan 24 jam, Akses Parkir,  Taman,  CCTV,  One Gate System, Track Lari, Tempat Jemuran"
https://www.rumah123.com/properti/bogor/hos11343658/#qid~f2ce3966-fc86-4c27-9a96-a48ab8055f9d,"Rumah Baru di Cluster Depan Equator, Sentul City Bogor",7000000000.0,"Cimanggis, Depok",Cimanggis,Bogor,4.0,4.0,360.0,400.0,HGB,5500.0,5.0,2.0,"Taman, Keamanan 24 jam, Akses Parkir,  Taman,  CCTV, Wastafel,  One Gate System, Track Lari, Tempat Jemuran"
https://www.rumah123.com/properti/bogor/hos11345605/#qid~f2ce3966-fc86-4c27-9a96-a48ab8055f9d,"Rumah Bagus Unfurnished SHM di Cluster Sentul Alaya, Bogor",1300000000.0,"Cilodong, Depok",Cilodong,Bogor,2.0,1.0,150.0,62.0,SHM,2200.0,4.0,1.0,"Taman, Keamanan 24 jam, Akses Parkir,  Taman,  CCTV, Wastafel,  One Gate System, Track Lari, Tempat Jemuran"
https://www.rumah123.com/properti/bogor/hos11343662/#qid~f2ce3966-fc86-4c27-9a96-a48ab8055f9d,"Rumah Baru Siap Huni di Cluster Victoria, Sentul City Bogor",945000000.0,"Cinere, Depok",Cinere,Bogor,3.0,1.0,90.0,70.0,SHM,1300.0,5.0,1.0,"Taman, Keamanan 24 jam,  Taman,  CCTV, Masjid,  Akses Parkir,  Playground,  One Gate System, Track Lari, Tempat Jemuran,  Tempat Laundry"
https://www.rumah123.com/properti/bogor/hos11343669/#qid~f2ce3966-fc86-4c27-9a96-a48ab8055f9d,"Rumah Semi Furnished Siap Huni di Cluster Taman Udayana, Bogor",1000000000.0,"Sentul City, Bogor",Sentul City,Bogor,2.0,1.0,150.0,63.0,SHM,1300.0,4.0,1.0,"Taman, Keamanan 24 jam, Akses Parkir,  Taman,  CCTV, Kitchen Set,  AC, Wastafel,  One Gate System, Track Lari, Tempat Jemuran"
https://www.rumah123.com/properti/bogor/hos11343665/#qid~f2ce3966-fc86-4c27-9a96-a48ab8055f9d,"Rumah Baru di Cluster Green Mountain, Sentul City Bogor",1250000000.0,"Denpasar Utara, Denpasar",Denpasar Utara,Bogor,3.0,2.0,84.0,89.0,Lainnya,2200.0,5.0,2.0,"Taman, Keamanan 24 jam, Akses Parkir,  Taman,  CCTV, Wastafel,  One Gate System, Track Lari, Tempat Jemuran"
https://www.rumah123.com/properti/bogor/hos11343663/#qid~f2ce3966-fc86-4c27-9a96-a48ab8055f9d,"Rumah Baru Siap Huni di Cluster Green Mountain, Sentul City Bogor",1650000000.0,"Cibinong, Bogor",Cibinong,Bogor,3.0,2.0,84.0,89.0,Lainnya,2200.0,5.0,2.0,"Taman, Keamanan 24 jam, Akses Parkir,  Taman,  CCTV, Wastafel,  One Gate System, Track Lari, Tempat Jemuran"
https://www.rumah123.com/properti/bogor/hos11343661/#qid~f2ce3966-fc86-4c27-9a96-a48ab8055f9d,"Rumah Sudah Renovasi Siap Huni di Cluster Victoria, Sentul City",1150000000.0,"Citra Garden, Jakarta Barat",Citra Garden,Bogor,3.0,2.0,90.0,150.0,SHM,5500.0,3.0,2.0,"Taman, Keamanan 24 jam,  Taman,  CCTV, Masjid, Kitchen Set,  AC,  Akses Parkir,  Playground, Wastafel,  One Gate System, Track Lari, Tempat Jemuran,  Tempat Laundry"
https://www.rumah123.com/properti/bogor/hos11343657/#qid~f2ce3966-fc86-4c27-9a96-a48ab8055f9d,"Rumah Baru di Cluster Terdepan Argenia Equator, Sentul City Bogor",6500000000.0,"Puri Indah, Jakarta Barat",Puri Indah,Bogor,4.0,5.0,313.0,360.0,HGB,5500.0,5.0,2.0,"Taman, Keamanan 24 jam, Akses Parkir,  Taman,  CCTV, Wastafel,  One Gate System, Tempat Jemuran"
https://www.rumah123.com/properti/bogor/hos11360185/#qid~f2ce3966-fc86-4c27-9a96-a48ab8055f9d,Jual Rumah Mewah View Bagus di Cluster Northridge Sentul City,30000000000.0,"Puri Indah, Jakarta Barat",Puri Indah,Bogor,5.0,5.0,2786.0,1500.0,SHM,5500.0,4.0,2.0,"Keamanan 24 jam, Taman, Jalur Telepon,  CCTV,  Playground,  One Gate System, Track Lari"
https://www.rumah123.com/properti/bogor/hos11359404/#qid~f2ce3966-fc86-4c27-9a96-a48ab8055f9d,Rumah posisi hook Sentul city,2300000000.0,"Percetakan Negara, Jakarta Pusat",Percetakan Negara,Bogor,3.0,2.0,299.0,125.0,Lainnya,2200.0,2.0,2.0,"Taman, Jalur Telepon,  Jalur Telepon, Keamanan, AC,  Ac, Track Lari,  Jogging Track"
https://www.rumah123.com/properti/bogor/hos11359404/#qid~e056ee6a-d107-43d0-9a8c-2dccee850664,Rumah posisi hook Sentul city,2300000000.0,"Pondok Indah, Jakarta Selatan",Pondok Indah,Bogor,3.0,2.0,299.0,125.0,Lainnya,2200.0,2.0,2.0,"Taman, Jalur Telepon,  Jalur Telepon, Keamanan, AC,  Ac, Track Lari,  Jogging Track"
https://www.rumah123.com/properti/bogor/hos11359373/#qid~e056ee6a-d107-43d0-9a8c-2dccee850664,Rumah view gunung hilltop Sentul city,2750000000.0,"Pondok Indah, Jakarta Selatan",Pondok Indah,Bogor,4.0,3.0,220.0,221.0,Lainnya,2200.0,2.0,3.0,"Taman,  Taman, Jalur Telepon,  AC, Jogging Track, AC,  Keamanan, Track Lari"
https://www.rumah123.com/properti/bogor/hos11359451/#qid~e056ee6a-d107-43d0-9a8c-2dccee850664,Rumah murah cluster lavanois village Sentul city,2400000000.0,"Kebayoran Baru, Jakarta Selatan",Kebayoran Baru,Bogor,3.0,3.0,183.0,145.0,SHM,3300.0,2.0,2.0,"Taman,  Taman,  Masjid, Jalur Telepon,  Jalur Telepon,  AC, Jogging Track, Kolam Renang, AC,  Keamanan, Track Lari"
https://www.rumah123.com/properti/bogor/hos11358058/#qid~25cd513f-2434-41fc-86dd-6c810c0bdb94,Jual Rumah Di Tengah Kota Sentul City Bogor,1200000000.0,"Gading Serpong, Tangerang",Gading Serpong,Bogor,4.0,4.0,120.0,240.0,SHM,1300.0,4.0,2.0," Taman, Wastafel, Jalur Telepon, Tempat Jemuran"
https://www.rumah123.com/properti/bogor/hos11355249/#qid~25cd513f-2434-41fc-86dd-6c810c0bdb94,Rumah Baru Type Scandinavian Surat SHM Cluster Depan di Sentul City,945000000.0,"Alam Sutera, Tangerang",Alam Sutera,Bogor,3.0,1.0,90.0,70.0,SHM,1300.0,5.0,1.0,"Taman, Keamanan 24 jam,  Taman, Masjid,  Playground,  One Gate System, Tempat Jemuran"
https://www.rumah123.com/properti/bogor/hos11355268/#qid~25cd513f-2434-41fc-86dd-6c810c0bdb94,"Rumah Minimalis 2 Lantai Siap Huni di Sentul City, Bogor",1650000000.0,"Tangerang, Tangerang",Tangerang,Bogor,3.0,2.0,84.0,89.0,HGB,2200.0,4.0,2.0,"Taman, One Gate System, Tempat Jemuran, Keamanan 24 jam"
https://www.rumah123.com/properti/bogor/hos11355305/#qid~25cd513f-2434-41fc-86dd-6c810c0bdb94,"Rumah Minimalis di Bawah Pasaran Siap Huni di Sentul City, Bogor",1250000000.0,"BSD City, Tangerang",BSD City,Bogor,3.0,2.0,84.0,89.0,Lainnya,2200.0,4.0,2.0,"Taman, One Gate System, Tempat Jemuran, Keamanan 24 jam"
https://www.rumah123.com/properti/bogor/hos11355336/#qid~25cd513f-2434-41fc-86dd-6c810c0bdb94,Rumah Minimalis 2 Lantai Surat SHM Cluster Depan di Sentul City,1150000000.0,"BSD, Tangerang",BSD,Bogor,3.0,2.0,90.0,150.0,SHM,5500.0,4.0,2.0,"Taman, Keamanan 24 jam,  Taman, Kitchen Set, Masjid,  Playground, AC,  One Gate System, Tempat Jemuran"
https://www.rumah123.com/properti/bogor/hos11355887/#qid~25cd513f-2434-41fc-86dd-6c810c0bdb94,Rumah Minimalis Siap Huni Surat SHM di Sentul Alaya,1300000000.0,"Graha Raya, Tangerang Selatan",Graha Raya,Bogor,2.0,1.0,150.0,62.0,SHM,2200.0,4.0,1.0,"Taman, Keamanan 24 jam, One Gate System,  Playground, Tempat Jemuran, Lapangan Basket"
https://www.rumah123.com/properti/bogor/hos11355890/#qid~25cd513f-2434-41fc-86dd-6c810c0bdb94,"Rumah Minimalis Lingkungan Asri Surat SHM di Sentul City, Bogor",1250000000.0,"BSD, Tangerang",BSD,Bogor,3.0,2.0,144.0,88.0,SHM,2200.0,4.0,1.0,"Taman, One Gate System, Tempat Jemuran, Keamanan 24 jam"
https://www.rumah123.com/properti/bogor/hos11345614/#qid~25cd513f-2434-41fc-86dd-6c810c0bdb94,"Rumah 2 Lantai Baru Unfurnished di River View, Bogor",11000000000.0,"Pejaten, Jakarta Selatan",Pejaten,Bogor,4.0,4.0,543.0,495.0,Lainnya,5500.0,5.0,2.0,"Keamanan 24 jam,  Taman, Akses Parkir,  CCTV, Kolam Renang, Wastafel,  One Gate System, Track Lari, Tempat Jemuran"
https://www.rumah123.com/properti/bogor/hos11345604/#qid~25cd513f-2434-41fc-86dd-6c810c0bdb94,"Rumah Bagus Siap Huni di Cluster Hiltop, Sentul City Bogor",5000000000.0,"Cibubur, Jakarta Timur",Cibubur,Bogor,4.0,3.0,396.0,299.0,HGB,4400.0,4.0,2.0,"Taman, Keamanan 24 jam, Akses Parkir,  Taman,  CCTV, Wastafel,  One Gate System, Track Lari, Tempat Jemuran"
https://www.rumah123.com/properti/bogor/hos11345604/#qid~b2d78676-f2d8-4857-92e0-0db041e64cd8,"Rumah Bagus Siap Huni di Cluster Hiltop, Sentul City Bogor",5000000000.0,"BSD City, Tangerang",BSD City,Bogor,4.0,3.0,396.0,299.0,HGB,4400.0,4.0,2.0,"Taman, Keamanan 24 jam, Akses Parkir,  Taman,  CCTV, Wastafel,  One Gate System, Track Lari, Tempat Jemuran"
https://www.rumah123.com/properti/bogor/hos11343668/#qid~b2d78676-f2d8-4857-92e0-0db041e64cd8,"Rumah Bagus Semi Furnished Siap Huni di Cluster Imperial, Bogor",3500000000.0,"Bintaro, Tangerang Selatan",Bintaro,Bogor,4.0,4.0,321.0,500.0,HGB,4400.0,4.0,2.0,"Taman, Keamanan 24 jam, Akses Parkir,  Taman,  CCTV, Kitchen Set,  AC, Wastafel,  One Gate System, Track Lari, Tempat Jemuran"
https://www.rumah123.com/properti/bogor/hos11343641/#qid~b2d78676-f2d8-4857-92e0-0db041e64cd8,"Rumah 2 Lantai Baru Unfurnished HGB di Equator, Bogor",6500000000.0,"Bintaro, Tangerang Selatan",Bintaro,Bogor,4.0,5.0,313.0,360.0,HGB,5500.0,5.0,2.0,"Taman, Keamanan 24 jam, Akses Parkir,  Taman,  CCTV,  One Gate System, Track Lari, Tempat Jemuran"
https://www.rumah123.com/properti/bogor/hos11343645/#qid~b2d78676-f2d8-4857-92e0-0db041e64cd8,"Rumah Butuh Renovasi Unfurnished di Imperial, Bogor",4500000000.0,"Pamulang, Tangerang Selatan",Pamulang,Bogor,3.0,2.0,575.0,200.0,Lainnya,2200.0,2.0,1.0,"Taman, Keamanan 24 jam, Akses Parkir,  Taman,  CCTV,  One Gate System, Track Lari, Tempat Jemuran"
https://www.rumah123.com/properti/bogor/hos11343642/#qid~b2d78676-f2d8-4857-92e0-0db041e64cd8,"Rumah 2 Lantai Baru Unfurnished HGB di Equator, Bogor",7000000000.0,"Bintaro, Tangerang Selatan",Bintaro,Bogor,4.0,4.0,340.0,400.0,HGB,5500.0,5.0,2.0,"Taman, Keamanan 24 jam, Akses Parkir,  Taman,  CCTV, Wastafel,  One Gate System, Track Lari, Tempat Jemuran"
https://www.rumah123.com/properti/bogor/hos11343655/#qid~b2d78676-f2d8-4857-92e0-0db041e64cd8,"Rumah Bagus Semi Furnished SHM di Taman Udayana, Bogor",1000000000.0,"Serpong Regency Melati Mas, Tangerang Selatan",Serpong Regency Melati Mas,Bogor,2.0,1.0,150.0,63.0,SHM,1300.0,4.0,1.0,"Taman, Keamanan 24 jam, Akses Parkir,  Taman,  CCTV, Kitchen Set,  AC, Wastafel,  One Gate System, Track Lari, Tempat Jemuran"
https://www.rumah123.com/properti/bogor/hos11343656/#qid~b2d78676-f2d8-4857-92e0-0db041e64cd8,"Rumah Baru Siap Huni di Cluster Northridge, Sentul City Bogor",11500000000.0,"Bintaro, Tangerang Selatan",Bintaro,Bogor,4.0,5.0,518.0,515.0,HGB,5500.0,5.0,3.0,"Keamanan 24 jam,  Taman, Akses Parkir,  CCTV, Kolam Renang, Wastafel,  One Gate System, Track Lari, Tempat Jemuran"
https://www.rumah123.com/properti/bogor/hos11285691/#qid~b2d78676-f2d8-4857-92e0-0db041e64cd8,"Rumah Mewah Hook, Tepi Danau Sentul City",8500000000.0,"Graha Raya, Tangerang Selatan",Graha Raya,Bogor,5.0,6.0,483.0,500.0,HGB,7700.0,4.0,3.0,"Keamanan 24 jam, Taman,  Taman, Kitchen Set, Kolam Renang, Wastafel,  One Gate System, Tempat Jemuran"
https://www.rumah123.com/properti/bogor/hos11342048/#qid~b2d78676-f2d8-4857-92e0-0db041e64cd8,"Rumah 2 Lantai Bagus Semi Furnished, Siap Huni, di Cluster Sentul City, Bogor",2500000000.0,"Wiyung, Surabaya",Wiyung,Bogor,4.0,4.0,180.0,300.0,SHM,5500.0,4.0,2.0,"Taman, Keamanan 24 jam, Akses Parkir,  Taman,  CCTV, Kitchen Set,  AC, Wastafel, Tempat Jemuran,  One Gate System,  Kolam Ikan"
https://www.rumah123.com/properti/bogor/hos11342133/#qid~b2d78676-f2d8-4857-92e0-0db041e64cd8,"Rumah Minimalis Murah di Sentul City, Bogor",750000000.0,"Sidoarjo, Sidoarjo",Sidoarjo,Bogor,2.0,2.0,105.0,60.0,SHM,1300.0,4.0,1.0,"Taman, Keamanan 24 jam, Akses Parkir,  Taman,  Playground,  One Gate System, Wastafel"
https://www.rumah123.com/properti/bogor/hos11342250/#qid~b2d78676-f2d8-4857-92e0-0db041e64cd8,"Rumah Minimalis Modern Baru, Siap Huni, di Cluster Sentul City, Bogor",5000000000.0,"Sunter, Jakarta Utara",Sunter,Bogor,4.0,3.0,396.0,299.0,HGB,4400.0,5.0,2.0,"Taman, Keamanan 24 jam, Akses Parkir,  Taman,  Playground,  One Gate System, Wastafel"
https://www.rumah123.com/properti/bogor/hos11343650/#qid~b2d78676-f2d8-4857-92e0-0db041e64cd8,"Rumah 2 Lantai Baru Unfurnished di Green Mountain, Bogor",1250000000.0,"Kelapa Gading, Jakarta Utara",Kelapa Gading,Bogor,3.0,2.0,84.0,89.0,Lainnya,2200.0,5.0,2.0,"Taman, Keamanan 24 jam, Akses Parkir,  Taman,  CCTV, Wastafel,  One Gate System, Track Lari, Tempat Jemuran"
https://www.rumah123.com/properti/bogor/hos11343653/#qid~b2d78676-f2d8-4857-92e0-0db041e64cd8,"Rumah 2 Lantai Bagus Semi Furnished HGB di Imperial, Bogor",3500000000.0,"Sunter, Jakarta Utara",Sunter,Bogor,4.0,4.0,321.0,500.0,HGB,4400.0,4.0,2.0,"Taman, Keamanan 24 jam, Akses Parkir,  Taman,  CCTV, Kitchen Set,  AC, Wastafel,  One Gate System, Track Lari, Tempat Jemuran"
https://www.rumah123.com/properti/bogor/hos11343649/#qid~b2d78676-f2d8-4857-92e0-0db041e64cd8,"Rumah Baru Unfurnished di Green Mountain, Sentul City Bogor",1650000000.0,"Jakarta Garden City, Jakarta Timur",Jakarta Garden City,Bogor,3.0,2.0,84.0,89.0,Lainnya,2200.0,5.0,1.0,"Taman, Keamanan 24 jam, Akses Parkir,  Taman,  CCTV, Wastafel,  One Gate System, Track Lari, Tempat Jemuran"
https://www.rumah123.com/properti/bogor/hos11343646/#qid~b2d78676-f2d8-4857-92e0-0db041e64cd8,Rumah 2 Lantai Sudah Renovasi Semi Furnished SHM di Victoria,1150000000.0,"Cakung, Jakarta Timur",Cakung,Bogor,3.0,2.0,90.0,150.0,SHM,5500.0,3.0,2.0,"Taman, Keamanan 24 jam,  Taman,  CCTV, Masjid, Kitchen Set,  AC,  Akses Parkir,  Playground, Wastafel,  One Gate System, Track Lari, Tempat Jemuran,  Tempat Laundry"
https://www.rumah123.com/properti/bogor/hos11343647/#qid~b2d78676-f2d8-4857-92e0-0db041e64cd8,"Rumah Baru Unfurnished SHM di Victoria, Bogor",945000000.0,"Batam Kota, Batam",Batam Kota,Bogor,3.0,1.0,90.0,70.0,SHM,1300.0,5.0,1.0,"Taman, Keamanan 24 jam,  Taman,  CCTV, Masjid,  Akses Parkir,  Playground,  One Gate System, Track Lari, Tempat Jemuran,  Tempat Laundry"
https://www.rumah123.com/properti/bogor/hos11356281/#qid~b2d78676-f2d8-4857-92e0-0db041e64cd8,Rumah Baru SHM Dengan Udara Yang Sejuk Dan Asri di Sentul City Bogor,945000000.0,"Puri Indah, Jakarta Barat",Puri Indah,Bogor,3.0,1.0,90.0,70.0,SHM,1300.0,5.0,1.0,"Taman, Tempat Jemuran, Keamanan 24 jam,  One Gate System"
https://www.rumah123.com/properti/bogor/hos11356283/#qid~8a6bc583-76d8-47cc-91fc-993ba8c3ab73,"Rumah 2 Lantai Baru Unfurnished di Sentul City , Bogor",1650000000.0,"Kemang, Jakarta Selatan",Kemang,Bogor,3.0,2.0,84.0,89.0,Lainnya,1300.0,5.0,2.0,"Taman, Keamanan 24 jam, Wastafel,  One Gate System, Tempat Jemuran"
https://www.rumah123.com/properti/bogor/hos11356276/#qid~8a6bc583-76d8-47cc-91fc-993ba8c3ab73,Rumah 2 Lantai Baru Lantai Marmer di Area Sentul City Bogor,11500000000.0,"Sentul City, Bogor",Sentul City,Bogor,4.0,5.0,518.0,515.0,HGB,5500.0,5.0,2.0," Kolam Renang, Keamanan 24 jam,  Taman, Taman, Jalur Telepon, AC, Wastafel,  One Gate System, Track Lari, Tempat Jemuran"
https://www.rumah123.com/properti/bogor/hos11356277/#qid~8a6bc583-76d8-47cc-91fc-993ba8c3ab73,"Rumah 2 Lantai Baru Unfurnished HGB di Sentul City , Bogor",6500000000.0,"Green Lake City, Jakarta Barat",Green Lake City,Bogor,4.0,5.0,313.0,360.0,HGB,5500.0,5.0,2.0," Kolam Renang, Keamanan 24 jam,  Taman, Jalur Telepon, Masjid,  Playground, Wastafel,  One Gate System, Tempat Jemuran"
https://www.rumah123.com/properti/bogor/hos11356278/#qid~8a6bc583-76d8-47cc-91fc-993ba8c3ab73,"Rumah 2 Lantai Baru Unfurnished HGB di Sentul City , Bogor",7000000000.0,"Kebayoran Baru, Jakarta Selatan",Kebayoran Baru,Bogor,4.0,4.0,340.0,400.0,HGB,5500.0,5.0,2.0," Kolam Renang, Keamanan 24 jam,  Taman, Jalur Telepon, Masjid,  Playground, Wastafel,  One Gate System, Track Lari, Tempat Jemuran"
https://www.rumah123.com/properti/bogor/hos11356279/#qid~8a6bc583-76d8-47cc-91fc-993ba8c3ab73,Rumah Brgitu Adanya di Area Sentul City Bogor,4500000000.0,"Kalideres, Jakarta Barat",Kalideres,Bogor,3.0,2.0,575.0,200.0,Lainnya,2200.0,4.0,1.0,"Taman, Keamanan 24 jam, Wastafel,  One Gate System, Tempat Jemuran"
https://www.rumah123.com/properti/bogor/hos11356280/#qid~8a6bc583-76d8-47cc-91fc-993ba8c3ab73,"Rumah 2 Lantai Bagus Semi Furnished SHM di Sentul City , Bogor",1150000000.0,"Bekasi Utara, Bekasi",Bekasi Utara,Bogor,3.0,2.0,90.0,150.0,SHM,5500.0,4.0,2.0,"Taman, Keamanan 24 jam, Kitchen Set,  AC, Wastafel,  One Gate System, Tempat Jemuran"
https://www.rumah123.com/properti/bogor/hos11356282/#qid~8a6bc583-76d8-47cc-91fc-993ba8c3ab73,"Rumah 2 Lantai Baru Unfurnished di Sentul City , Bogor",1250000000.0,"Tanjung Duren, Jakarta Barat",Tanjung Duren,Bogor,3.0,2.0,84.0,89.0,Lainnya,2200.0,5.0,2.0,"Taman, Tempat Jemuran, Keamanan 24 jam,  One Gate System"
https://www.rumah123.com/properti/bogor/hos11356284/#qid~8a6bc583-76d8-47cc-91fc-993ba8c3ab73,"Rumah 2 Lantai Bagus Semi Furnished HGB di Sentul City , Bogor",3500000000.0,"Cipayung, Depok",Cipayung,Bogor,4.0,4.0,321.0,500.0,HGB,4400.0,4.0,2.0,"Taman, Keamanan 24 jam, Kitchen Set,  AC, Wastafel,  One Gate System, Tempat Jemuran"
https://www.rumah123.com/properti/bogor/hos11356285/#qid~8a6bc583-76d8-47cc-91fc-993ba8c3ab73,"Rumah Bagus Semi Furnished SHM di Sentul City , Bogor",1000000000.0,"Tanah Sareal, Bogor",Tanah Sareal,Bogor,2.0,1.0,150.0,63.0,SHM,1300.0,4.0,1.0,"Taman, Keamanan 24 jam, Kitchen Set,  AC, Wastafel,  One Gate System, Tempat Jemuran"
https://www.rumah123.com/properti/bogor/hos11355310/#qid~8a6bc583-76d8-47cc-91fc-993ba8c3ab73,"Rumah Minimalis Siap Huni Semi Furnished di Sentul City, Bogor",3500000000.0,"Cileungsi, Bogor",Cileungsi,Bogor,4.0,4.0,321.0,500.0,HGB,4400.0,4.0,2.0,"Taman, Keamanan 24 jam, One Gate System, Kitchen Set,  AC, Wastafel, Tempat Jemuran"
https://www.rumah123.com/properti/bogor/hos11355888/#qid~8a6bc583-76d8-47cc-91fc-993ba8c3ab73,"Rumah Minimalis 2 Lantai Cluster Depan di Sentul City, Bogor",5000000000.0,"Margonda, Depok",Margonda,Bogor,4.0,3.0,396.0,299.0,HGB,4400.0,4.0,2.0,"Taman, One Gate System, Tempat Jemuran, Keamanan 24 jam"
https://www.rumah123.com/properti/bogor/hos11355883/#qid~8a6bc583-76d8-47cc-91fc-993ba8c3ab73,"Rumah Classic Butuh Renovasi, Cluster Imperial di Sentul City",6000000000.0,"Margonda, Depok",Margonda,Bogor,4.0,4.0,526.0,400.0,Lainnya,3300.0,2.0,2.0,"Taman, One Gate System, Tempat Jemuran, Keamanan 24 jam"
https://www.rumah123.com/properti/bogor/hos11355885/#qid~8a6bc583-76d8-47cc-91fc-993ba8c3ab73,Rumah Minimalis 2 Lantai Siap Huni Dekat Jungleland di Sentul City,2300000000.0,"Tanjung Duren, Jakarta Barat",Tanjung Duren,Bogor,3.0,2.0,299.0,125.0,Lainnya,2200.0,4.0,2.0,"Taman, Keamanan 24 jam,  Playground,  One Gate System, Tempat Jemuran"
https://www.rumah123.com/properti/bogor/hos11356291/#qid~8a6bc583-76d8-47cc-91fc-993ba8c3ab73,"Rumah 2 Lantai Baru Unfurnished di Sentul City , Bogor",11000000000.0,"Summarecon Bekasi, Bekasi",Summarecon Bekasi,Bogor,4.0,4.0,543.0,495.0,Lainnya,5500.0,5.0,2.0," Kolam Renang, Keamanan 24 jam,  Taman, Taman, Jalur Telepon, Wastafel,  One Gate System, Tempat Jemuran"
https://www.rumah123.com/properti/bogor/hos11356289/#qid~0a74697a-ab92-4dc2-a303-0dd9d0bcbe67,"Rumah 2 Lantai Bagus Unfurnished di Sentul City , Bogor",6000000000.0,"Cempaka Putih, Jakarta Pusat",Cempaka Putih,Bogor,4.0,4.0,526.0,400.0,Lainnya,3500.0,4.0,2.0,"Taman, Keamanan 24 jam, Wastafel,  One Gate System, Tempat Jemuran"
https://www.rumah123.com/properti/bogor/hos11356287/#qid~0a74697a-ab92-4dc2-a303-0dd9d0bcbe67,"Rumah Bagus Unfurnished SHM di Sentul City , Bogor",9500000000.0,"Jagakarsa, Jakarta Selatan",Jagakarsa,Bogor,2.0,1.0,108.0,62.0,SHM,1300.0,4.0,1.0,"Taman, Keamanan 24 jam,  Playground, Wastafel,  One Gate System, Tempat Jemuran"
https://www.rumah123.com/properti/bogor/hos11356286/#qid~0a74697a-ab92-4dc2-a303-0dd9d0bcbe67,"Rumah 2 Lantai Bagus Unfurnished HGB di Sentul City, Bogor",5000000000.0,"Cibubur, Jakarta Timur",Cibubur,Bogor,4.0,3.0,396.0,299.0,HGB,4400.0,4.0,2.0,"Taman, Keamanan 24 jam, Wastafel,  One Gate System, Tempat Jemuran"
